,Title,Source,Description,Keywords
1149,Edo mono mairi no tei (Sightseeing in Edo),https://research.britishmuseum.org/collectionimages/AN00417/AN00417987_001_l.jpg,"Woodblock print with hand-colouring. One of a set of twelve sheets. Cherry-viewing parties; one samurai with two attendants and five women, also with two attendants, passing each other; servants carrying picnic boxes and equipment on poles. Inscribed.",seasons;flower
1150,Tora no koku / Seiro juni toki tsuzuki,https://research.britishmuseum.org/collectionimages/AN00526/AN00526156_001_l.jpg,"Woodblock print. Popular culture. Hour of the tiger, two women discussing the night's activities beside a hibachi. Nishiki-e on paper.",mammal
1151,print,https://research.britishmuseum.org/collectionimages/AN00419/AN00419931_001_l.jpg,Woodblock print. Woman's paper handkerchiefs blowing away with love-letter. With poem. Inscribed and signed.,bijin
1152,print,https://research.britishmuseum.org/collectionimages/AN00594/AN00594566_001_l.jpg,Woodblock print with some hand-colouring. Pleasure-boat by Ryogoku Bridge on Sumida River; ferry on left. Inscribed.,boat/ship
1153,print,https://research.britishmuseum.org/collectionimages/AN00423/AN00423210_001_l.jpg,"Woodblock print. Popular culture. Girl behind mosquito-net with taper and fan greeting arrival of her lover,with kamuro asleep on floor.Poem.1 of 2. Nishiki-e on paper.",kamuro
1154,I no koku / Seiro juni toki tsuzuki,https://research.britishmuseum.org/collectionimages/AN00526/AN00526155_001_l.jpg,"Woodblock print. Bijinga. popular culture. Hour of the boar, courtesan with saucer of sake, kamuro with kettle. Nishiki-e on paper.",courtesan/prostitute;literature;bijin;kamuro
1155,Tori no koku / Seiro juni toki tsuzuki,https://research.britishmuseum.org/collectionimages/AN00526/AN00526153_001_l.jpg,"Woodblock print. Bijinga. popular culture. Hour of the cockerel, courtesan with maid hurrying with lantern. Nishiki-e on paper.",servant/domestic worker;courtesan/prostitute;bird;bijin
1156,print,https://research.britishmuseum.org/collectionimages/AN00418/AN00418029_001_l.jpg,"Woodblock print. Actor Yamamura Ichitaro in female part; decorated battledores, pine-fronds and rice-cake on an offering-stand on his outer dress. With hand-colouring, lacquer (ink and glue) and metal dust. Signed and marked.",kabuki;actor/actress
1157,egoyomi,https://research.britishmuseum.org/collectionimages/AN00420/AN00420791_001_l.jpg,Woodblock print. Popular culture. Courtesan and client as Han Shan (Kanzan) and Shi De (Jittoku) examining a scroll displaying months for the year 1747. Benizuri-e and in gauffrage on paper. According to reg. calendar print.,courtesan/prostitute
1158,"Shin-Yoshiwara Gocho-machi Omon-guchi uki-e ・・ｰ・・・・・・・ｺ・・ｸ・・・ｺ・､ｧ・・・・｣・・・・・・・・・ (Perspective Picture of the Main Gate of Yoshiwara, the Town of Five Streets)",https://research.britishmuseum.org/collectionimages/AN00420/AN00420784_001_l.jpg,"Woodblock print, diptych. Uki-e. Townscape. The Daimon gateway to Kocho-machi in the Shin-Yoshiwara. Sumizuri-e on paper.",uki-e;landscape
1159,Hokubo no Bijin Suzubaya Matsushima Chojiya Chozan / Tosei Nanboku no Bijin,https://research.britishmuseum.org/collectionimages/AN00423/AN00423918_001_l.jpg,"Woodblock print. Bijinga. Figures of beauties sitting and standing,veranda,(according to register, Beaties of the North). Nishiki-e on paper.",bijin
1160,print,https://research.britishmuseum.org/collectionimages/AN00513/AN00513112_001_l.jpg,"Woodblock print. Kabuki. Scene from a joruri play, an actor as a courtesan, with Matsumoto Koshiro as a samisen player and reciters behind. Nishiki-e on paper.",puppetry;courtesan/prostitute;musical instrument;kabuki;actor/actress
1161,"Arashi Murajiro as Chieda no kitsune, Ichikawa Yaozo as Kusunoki Uraminosuke ・ｵ・・・・・ｬ｡・・・・・ｮ・・・・・・・・ｮ・・・・・・ｸ・・ｷ・・・ｫ・・ｾ・・ｵ・・ｮ・･・・ｨ・ｹ・・ｻ・",https://research.britishmuseum.org/collectionimages/AN00425/AN00425655_001_l.jpg,"Woodblock print, diptych. Kabuki. Actors Nakamura Ryuzo in female role and Ichikawa Yaozo as male,performing fox-dance in snowy garden. Nishiki-e on paper.",snow;kabuki;garden;dance;actor/actress
1162,painting / calligraphy / album,https://research.britishmuseum.org/collectionimages/AN00813/AN00813623_001_l.jpg,"Painting, album. 28 double-page pictures, with 'kyoka' poems. Ink and colour on paper.",kyoka
1163,painting / hanging scroll,https://research.britishmuseum.org/collectionimages/AN01440/AN01440785_001_l.jpg,[Jap.Ptg.1604] -,devil/demon;deity
1164,painting,https://research.britishmuseum.org/collectionimages/AN00759/AN00759450_001_l.jpg,Painting. Sake bottles on tray. Lacquer on paper.,food/drink
1165,painting / handscroll,https://research.britishmuseum.org/collectionimages/AN01400/AN01400570_001_l.jpg,[Jap.Ptg.1575(T)] -,procession
1166,painting / hanging scroll,https://research.britishmuseum.org/collectionimages/AN00230/AN00230398_001_l.jpg,Painting. Courtesan and 2 kamuro. Ink and colours on paper.,courtesan/prostitute
1167,painting / hanging scroll,https://research.britishmuseum.org/collectionimages/AN00240/AN00240166_001_l.jpg,Hanging scroll. Occupation. Labourer breaking soil in field near village. Ink and colour on silk.,labourer/manual worker
1168,forgery / painting / hanging scroll,https://research.britishmuseum.org/collectionimages/AN01402/AN01402997_001_l.jpg,[Jap.Ptg.1452] -,myth/legend
1169,painting / hanging scroll,https://research.britishmuseum.org/collectionimages/AN00229/AN00229723_001_l.jpg,Hanging scroll. Woman with mattock and basket of pine branches. Ink and colours on silk.,bijin
1170,painting / hanging scroll,https://research.britishmuseum.org/collectionimages/AN00229/AN00229692_001_l.jpg,Hanging scroll. Back view of standing woman. Ink on paper.,courtesan/prostitute
1171,print,https://research.britishmuseum.org/collectionimages/AN00513/AN00513103_001_l.jpg,"Woodblock print. Kabuki. The actor Nakamura Nakazo in private, seated, pipe in hand at kotatsu talking to two girls, one showing him an open letter. Nishiki-e on paper.",smoking;kabuki;child;actor/actress
1172,Ushi no koku / Seiro juni toki tsuzuki,https://research.britishmuseum.org/collectionimages/AN00526/AN00526134_001_l.jpg,"Woodblock print. Popular culture. Hour of the ox, girl by screen, with lighted taper and letter. Nishiki-e on paper.",mammal;child
1173,Mi no koku / Seiro juni toki tsuzuki,https://research.britishmuseum.org/collectionimages/AN00526/AN00526131_001_l.jpg,"Woodblock print. Popular culture. Hour of the snake, a girl 'en deshabille' being offered tea by another girl. Nishiki-e on paper.",tea preparation/drinking;reptile;child
1174,Tatsu no koku / Seiro juni toki tsuzuki,https://research.britishmuseum.org/collectionimages/AN00526/AN00526152_001_l.jpg,"Woodblock print. Popular culture. Hour of the dragon, two girls under the same futon beginning to get up. Nishiki-e on paper.",furniture/woodwork;dragon;child
1175,print,https://research.britishmuseum.org/collectionimages/AN00521/AN00521074_001_l.jpg,Woodblock print. Kabuki. Actor Matsumoto Koshiro IV as Sakanaya Gorobei. Nishiki-e on paper.,smoking;kabuki;actor/actress
1176,"Yodo koitsu wa Nihon to iu ezoshi yori miru ・ｹｼ・ｫ･・ｺ・・ｭ､・･ｴ・・・・・･・・ｬ・・ｪ・ｦ・・ｵｵ・・・・ｴ・ (Chinese Children Learn about Japan from Looking at Picture Books) / Asobi sono ga'i san ・・・・・ｶ・・ｻ・・・・ｸ・ (Games as depicted, 3)",https://research.britishmuseum.org/collectionimages/AN00513/AN00513096_001_l.jpg,"Woodblock print.No 3, Chinese children at play with battledore and shuttlecock, with inscription continued from nos 1 and 2. Nishiki-e on paper.",sport/pastime;child
1177,Soga kyodai chichi no ada-uchi no zu ・・ｽ・・・・・・・ｼ・・・ｶ・・ｮ・ｻ・・ｨ・・・ｳ (The Soga Brothers Avenge Their Father),https://research.britishmuseum.org/collectionimages/AN00602/AN00602826_001_l.jpg,"Woodblock print, triptych. History, myth and legend. Soga no Goro Tokimune + assailants,+ wrestler Goromaru,+ brother fighting Tadatsune. Nishiki-e on paper.",wrestling/wrestler;myth/legend;history
1178,Fuzoku Azuma no nishiki ・｢ｨ・ｿ・・・ｱ・ｹ・・・ｦ (Brocades of the East in Daily Life),https://research.britishmuseum.org/collectionimages/AN00513/AN00513366_001_l.jpg,"Woodblock print. Popular culture. A small girl in long kimono on shoulders of man-servant on way to temple, with girl and two others. Nishiki-e on paper.",temple;servant/domestic worker;child
1179,diptych print,https://research.britishmuseum.org/collectionimages/AN00607/AN00607542_001_l.jpg,"Woodblock print, diptych. Kabuki. Actor Nakamura Utaemon as Tabakoya Sankichi with Ichikawa Ebijuro as Saito Kuranosuke afraid of apparition of giant snake. Nishiki-e on paper.",reptile;kabuki;actor/actress
1180,Fuyu Sumidagawa (Winter: Sumida River) / Genji gappitsu shiki (Genji in the Four Seasons by Twin Brushes),https://research.britishmuseum.org/collectionimages/AN00694/AN00694579_001_l.jpg,"Woodblock print, triptych. Sumida river in winter, with man and woman emerging from boat with maid. Nishiki-e on paper.",servant/domestic worker;child;boat/ship
1181,Yodo-gawa / Kyoto Meisho no uchi,https://research.britishmuseum.org/collectionimages/AN00533/AN00533216_001_l.jpg,"Woodblock print. Rural landscape. Yodo river boats, figures, food, moon, bird. 1 of 2 impressions. Nishiki-e on paper.",moon;landscape;food/drink;bird
1182,pentaptych print,https://research.britishmuseum.org/collectionimages/AN00246/AN00246318_001_l.jpg,"Woodblock, pentatych. Popular culture. Drama. Girl in pleasure barge on Sumida, engaged in music-making, dancing and conversation. Nishiki-e on paper.",theatre/theatrical life;music;dance;boat/ship
1183,print,https://research.britishmuseum.org/collectionimages/AN00423/AN00423963_001_l.jpg,"Woodblock print.History, myth and legend. Omori Hikoshichi tussling with the demon amid rain. Nishiki-e on paper.",myth/legend;history;devil/demon
1184,Komatsuya-uchi Takamura / Hinagata Wakana no Hatsumoyo,https://research.britishmuseum.org/collectionimages/AN00423/AN00423189_001_l.jpg,Woodblock print. Bijinga. Takamura of Komatsuya with her 2 kamuro. Nishiki-e on paper.,courtesan/prostitute;bijin;kamuro
1185,print,https://research.britishmuseum.org/collectionimages/AN00420/AN00420890_001_l.jpg,"Woodblock print. Bijinga. Girl seated on floor of room making shadow on wall with chopsticks, + cock on snowy fence on the fusuma. Nishiki-e on paper.",vessel;snow;bird;bijin
1186,print,https://research.britishmuseum.org/collectionimages/AN00419/AN00419909_001_l.jpg,"Woodblock print. Kabuki. Actor Ichikawa Danjuro II as Yajirobei in play on theme of Soga Brothers' revenge; wearing straw hat. With quoted texts. With hand-colouring, lacquer (ink and glue) and metal dust. Inscribed.",kabuki;actor/actress
1187,painting / handscroll,https://research.britishmuseum.org/collectionimages/AN01312/AN01312862_001_l.jpg,"[Jap.Ptg.339, image 1]",trade/occupation;festival;animal
1188,Hiru saru no koku / Seiro Juni-ji,https://research.britishmuseum.org/collectionimages/AN00530/AN00530207_001_l.jpg,Woodblock print. Bijinga. classical series. Hanaogi of the Ogiya with her attendants Yoshino and Tatsuta. Nishiki-e on paper.,attendant;bijin
1189,painting / hanging scroll,https://research.britishmuseum.org/collectionimages/AN00229/AN00229662_001_l.jpg,"Hanging scroll. Legend. Kintoki and the tengus. Colours on silk. According to the catalogue, signed and seal.",myth/legend;fairy
1190,painting,https://research.britishmuseum.org/collectionimages/AN00792/AN00792355_001_l.jpg,"Sketch. Cat captured and tormented by rats. Ink and colours on paper. According to the catalogue, signed and seal.",cat
1191,painting,https://research.britishmuseum.org/collectionimages/AN00792/AN00792378_001_l.jpg,"Sketch. Frogs triumphing over snakes. Ink and colour on paper. According to the catalogue, signed and seal.",reptile;amphibian
1192,painting,https://research.britishmuseum.org/collectionimages/AN00387/AN00387159_001_l.jpg,"Sketch. Snake strung up on poles by frogs. Ink and colours on paper. According to the catalogue, signed and seal.",reptile;amphibian
1193,drawing,https://research.britishmuseum.org/collectionimages/AN00768/AN00768477_001_l.jpg,Drawing (recto). Sumo wrestlers. Ink on paper.,wrestling/wrestler;warrior;boat/ship
1194,painting / hanging scroll,https://research.britishmuseum.org/collectionimages/AN01364/AN01364257_001_l.jpg,"Painting, hanging scroll. Attack on the castle at the battle of Osaka, with Tokugawa Ieyasu and his troops in the background, and on the left the wounded receiving aid from the ladies of Hideyori's court. Ink and colours on silk.",castle/fort;battle
1195,Jijo hokun onna imagawa ・・・・･ｳ・ｮ・・ｨ・・･ｳ・ｻ・・ｷ・ (The Imagawa Precepts for Women: Treasured Instruction for Young Girls),https://research.britishmuseum.org/collectionimages/AN00513/AN00513070_001_l.jpg,"Woodblock print. Popular culture. Three girls in a boat on a river, signboard above reads Ebisu Maru. Nishiki-e on paper.",child;boat/ship
1196,painting,https://research.britishmuseum.org/collectionimages/AN00793/AN00793030_001_l.jpg,Painting in tanzaku format. Double bust portrait of Nakayama Bunshichi II (right) and Yamashita Yaozo I (left) from a group of twenty-six paintings. Ink and colour on paper. Signed and sealed.,kabuki;actor/actress
1197,Itako-bushi,https://research.britishmuseum.org/collectionimages/AN00189/AN00189745_001_l.jpg,Print.  Colour woodblock.  Hosoban.  Kano  Minshi I as Kagetsuin (right) and Arashi Kichisaburo II as Aoyagi Danjo (left),kabuki
1198,Yoshitoshi ryakuga ・・ｳ・ｹｴ・・･・・ｻ (Quick Drawings by Yoshitoshi),https://research.britishmuseum.org/collectionimages/AN00526/AN00526798_001_l.jpg,"Chuban woodblock print, relating to the group of 52 preparatory drawings.",
1199,Ukiyo Matabei meiga no kidoku ・ｵｮ・ｸ・・・・・ｹｳ・・・・・ｻ・・ｮ・･・・・ｹ (Miracle of Masterpieces by Floating-world Matabei),https://research.britishmuseum.org/collectionimages/AN00589/AN00589302_001_l.jpg,"Woodblock diptych print, oban tate-e. The kabuki actor Ichikawa Kodanji IV as Iwasa Matabei, surrounded by his Otsu-e drawings of legendary characters which have come to life.",mythical figure/creature;kabuki;draughtsman/painter;actor/actress
1200,Ukiyo Matabei meiga no kidoku ・ｵｮ・ｸ・・・・・ｹｳ・・・・・ｻ・・ｮ・･・・・ｹ (Miracle of Masterpieces by Floating-world Matabei),https://research.britishmuseum.org/collectionimages/AN00589/AN00589213_001_l.jpg,"Woodblock diptych print, oban tate-e. The kabuki actor Ichikawa Kodanji IV as Iwasa Matabei, surrounded by his Otsu-e drawings of legendary characters which have come to life.",mythical figure/creature;kabuki;draughtsman/painter;actor/actress
1201,(Ukiyo ehon) Nukume-dori (・ｵｮ・ｸ・・ｵｵ・・ｬ) ・ｪ・・・・・ｳ･ / Ehon Edo e sudare byobu,https://research.britishmuseum.org/collectionimages/AN01379/AN01379057_001_l.jpg,"[JH.97, vol. 2, image  1] -",
1202,Kﾃｴkoku kiken kanka no zu ・・・・・ｽ・ｲｴ・｡・・ｦｳ・・ｱ・ｹ・・・ｳ (Dignitaries of the Empire Viewing Cherry Blossoms),https://research.britishmuseum.org/collectionimages/AN16129/AN1612973262_l.jpg,"Colour woodblock print, triptych.  Meiji emperor (right) and empress (center) dressed in the European fashion of the late 1880s to view cherry blossoms  Two ladies of the court (left), likewise dressed in European fashion.",garden;emperor/empress;cherry blossom
1203,Nishinomaru kﾃｴkyo shinkei ・･ｿ・ｸｸ・・・・ｱ・・・・・・ｯ (True View of the Nishinomaru Imperial Palace),https://research.britishmuseum.org/collectionimages/AN16130/AN1613055783_l.jpg,"Colour woodblock print triptych. The imperial family against a view of the new imperial palace, constructed on the site of the former shogunal residence. The family is dressed in contemporary Victorian manner; the architecture is traditional. The emperor (centre) looks toward the imperial consort and his son, Yoshihito, the heir apparent and future Taisho Emperor.",palace/mansion;garden;emperor/empress
1204,Nakatsukasa / Mitate Sanjurokkasen no uchi ・ｦ・・ｫ・・ｸ・・・・・・ｭ・ｭ・・・ｰ・ｹ・・・・ (Viewed As the Thirty-six Immortal Poets),https://research.britishmuseum.org/collectionimages/AN00535/AN00535789_001_l.jpg,"Woodblock print. The kabuki actor Onoe Kikugoro III as the ghost of Yasukata haunting the ruined palace of Soma at Sashima, night landscape behind. Signed, inscribed and dated.",landscape;kabuki;ghost;actor/actress;mitate
1205,triptych print,https://research.britishmuseum.org/collectionimages/AN00632/AN00632526_001_l.jpg,"Triptych: woodblock-prints from an album of 104 sheets. The actors Ichikawa Shinsho as Soga no Juro Sukenari (right), Arashi Rikan as Kudo Suketsune (centre) and Nakamura Shikan as Soga no Goro Tokimune (left), in an imaginary Soga play (mitate).Signed.",kabuki;actor/actress;mitate
1206,print,https://research.britishmuseum.org/collectionimages/AN00423/AN00423033_001_l.jpg,Woodblock print. Bijinga. Girl seated by open window overlooking a bay with a hairpin in her right hand.1 of 2. Nishiki-e on paper.,seascape;bijin
1207,print,https://research.britishmuseum.org/collectionimages/AN00422/AN00422312_001_l.jpg,Woodblock print. Popular culture. Couple passing by the Yatsubashi bridge in the iris season as young man stoops to fasten his sandal. Nishiki-e on paper.,footwear;flower;bridge
1208,Fujiwara no Kiyomasa,https://research.britishmuseum.org/collectionimages/AN00421/AN00421926_001_l.jpg,"Woodblock print. Seascape. Classical literature. Seaweed gatherer in a boat, with distant village, and two cranes flying above. Poem by Fujiwara no Kiyomasa. Nishiki-e on paper.",seascape;literature;boat/ship;bird
1209,Fujiwara no Motozane,https://research.britishmuseum.org/collectionimages/AN00421/AN00421923_001_l.jpg,"Woodblock print. Popular culture. Woman drying clothes in garden, boy chasing chicks, unohana blooming. Poem by Fujiwara no Motozane. Nishiki-e on paper.",garden;domestic life;child;bird
1210,Fuzoku Mu-Tamagawa,https://research.britishmuseum.org/collectionimages/AN00612/AN00612168_001_l.jpg,"Woodblock print. Popular culture. Classical series. A girl looking at moon in water of river, with lespedeza; portrait of poet, inscription, poem. Nishiki-e on paper.",tree/bush;poet;moon;literature;child
1211,Kakoi no yoru no ame (Tea House in Night Rain) / Furyu jinrin mitate hakkei (People Stylishly Viewed as the Eight Views),https://research.britishmuseum.org/collectionimages/AN00423/AN00423714_001_l.jpg,"Woodblock print. Popular culture. Young man and girl taking tea in a room adjoining garden. (According to register, on balcony). Nishiki-e on paper.",tea preparation/drinking;garden;child;architectural feature;mitate
1212,polyptych print,https://research.britishmuseum.org/collectionimages/AN00432/AN00432638_001_l.jpg,The actor Segawa Kikunojo V as the courtesan Agemaki seated beneath cherry blossom. One sheet of a polyptych. Woodblock-printed,courtesan/prostitute;kabuki;cherry blossom;actor/actress
1213,shunga / print,https://research.britishmuseum.org/collectionimages/AN00830/AN00830832_001_l.jpg,Colour woodblock print. Five women in public bathhouse.,eroticism/sex;bath/bath-house
1214,Ichiro gafu ・ｸ・・・・ｻ・ｭ・ (Ichiro's Picture Album),https://research.britishmuseum.org/collectionimages/AN16129/AN1612921404_l.jpg,"Illustrated book, print. One volume.  'Kyoka' verses and designs demonstrating the artist's style. Colour woodblock-printed, with gauffrage.",literature;art;kyoka
1215,diptych print,https://research.britishmuseum.org/collectionimages/AN00510/AN00510844_001_l.jpg,"Woodblock print, diptych; from an album of 117 sheets. The actors Segawa Kikunojo and Ichikawa Danjuro.",kabuki;actor/actress
1216,shini-e / print,https://research.britishmuseum.org/collectionimages/AN00601/AN00601842_001_l.jpg,"Colour woodblock print from an album of 104 sheets. Memorial portrait (shini-e) of the actor Arashi Rikan I as Kiso Yoshinaka, riding on an ox. Signed.",mammal;kabuki;death;actor/actress
1217,print,https://research.britishmuseum.org/collectionimages/AN00601/AN00601839_001_l.jpg,"Colour woodblock print from an album of 104 sheets. The actors Nakamura Utaemon III as Ishikawa Goemon (right), and Arashi Kitsusaburo III as Goemon's son Goroichi (left). Signed.",kabuki;actor/actress
1218,print,https://research.britishmuseum.org/collectionimages/AN00601/AN00601788_001_l.jpg,"Colour woodblock print from an album of 104 sheets. Bust portrait in a circular frame (mirror ?) of the actor Arashi Kitsusaburo II (Rikan II) holding a woodblock print (signed) of his dead predecessor Arashi Kitsusaburo I (Kichisaburo II/Rikan I). Signed, sealed and inscription.",kabuki;actor/actress
1219,print,https://research.britishmuseum.org/collectionimages/AN00601/AN00601680_001_l.jpg,"Colour woodblock print from an album of 104 sheets. Ichikawa Ebijuro I as Kezori Kuemon (right) and Arashi Tomisaburo as the Courtesan Kojoro (left), in the play ""Yamato Kotoba Suikoden"" performed at the Naka theatre in the seventh month, 1822. Signed. (The figures have been cut from their background and stuck on new sheets of paper).",courtesan/prostitute;kabuki;actor/actress
1220,print,https://research.britishmuseum.org/collectionimages/AN00583/AN00583006_001_l.jpg,"Colour woodblock print from an album of 104 sheets. The actors Arashi Kitsusaburo II as Satomi Isuke (right) and Fujikawa Tomokichi II as the cooper's daughter O-Sen (left), in the play ""Mesiaku Kiriko no Akebone"", performed in Kyoto in the seventh month, 1826. Signed.",kabuki;actor/actress
1221,print,https://research.britishmuseum.org/collectionimages/AN00582/AN00582999_001_l.jpg,Colour woodblock print from an album of 104 sheets. The actors Arashi Kitsusaburo II (right) and Ichikawa Ebijuro I (left) making a speech (kojo) to the audience at the Kado theatre. Signed.,theatre/theatrical life;kabuki;audience/assembly;actor/actress
1222,Shikido torikumi juniban ・・ｲ・・・・・・・ｵ・・・・・ｺ・・・ｪ (Twelve Bouts in the Way of Love),https://research.britishmuseum.org/collectionimages/AN00509/AN00509693_001_l.jpg,Shunga. (12 Bouts in the Way of Love). Dalliance in a mixed public bath. Woodblock-printed. Inscribed.,eroticism/sex;bath/bath-house
1223,print,https://research.britishmuseum.org/collectionimages/AN00534/AN00534167_001_l.jpg,Woodblock print. Kabuki. Actor Onoe Matsusuke as a ghost. Nishiki-e on paper.,kabuki;ghost;actor/actress
1224,hashira-e,https://research.britishmuseum.org/collectionimages/AN00644/AN00644520_001_l.jpg,"Colour woodblock pillar print. Tea-stall waitress, serving at Sansha Daigongen shrine. Inscribed and signed.",bijin
1225,print,https://research.britishmuseum.org/collectionimages/AN00529/AN00529244_001_l.jpg,"Colour woodblock print. Bijinga. Ohisa of Takashima tea-house holding fan, pictured from front and back. Nishiki-e on paper; double sided. Inscribed, signed, sealed and marked.",bijin
1226,egoyomi,https://research.britishmuseum.org/collectionimages/AN00421/AN00421010_001_l.jpg,"Woodblock print. E-goyomi. Popular culture. Young girl and small boy trying to catch cicada on willow trunk with a long net. (According to register, calendar marks on boy's net for 1766). Nishiki-e on paper. Signed.",tree/bush;insect;child
1227,"Ogiya Yugiri, Fujiya Izaemon・・・・・ｱ・・､・・・ｧ・・・ｵ・・・・・・・ｼ・・ｽ・・｡・・・ (Ogiya Yugiri and Fujiya Izaemon) / Jitsu kurabe iro no minakami・・ｮ・・ｫｶ・・ｲ・ｹ・・ｾ・・・・・ｮｶ・ｦ・ (True Feelings Compared: The Founts of Love)",https://research.britishmuseum.org/collectionimages/AN00199/AN00199140_001_l.jpg,"Woodblock. Love. Popular culture. Ogiya Yugiri and Fujiya Isaemon, he playing the samisen, she stands above. Nishiki-e on paper.",theatre/theatrical life
1228,hashira-e,https://research.britishmuseum.org/collectionimages/AN00632/AN00632575_001_l.jpg,Colour woodblock pillar print. Inside and outside mosquito net: woman under mosquito net pursuing insects with taper; young man to intrude. Sealed.,fuzoku
1229,print,https://research.britishmuseum.org/collectionimages/AN00527/AN00527144_001_l.jpg,"Colour woodblock print (revamped). Kabuki actor Yoshizawa Iroha I as Osato, daughter of sushi chef in play 'Senbon-zakura'. Nishiki-e on paper. Inscribed and signed.",kabuki;actor/actress
1230,print / hashira-e,https://research.britishmuseum.org/collectionimages/AN00637/AN00637066_001_l.jpg,"Colour woodblock pillar print. Bijinga. Tea-house beauty Okita at shopfront, accompanied by young woman with toy dog; surimono greeting cards stuck to wall behind her. Signed and marked.",bijin
1231,print,https://research.britishmuseum.org/collectionimages/AN00521/AN00521095_001_l.jpg,"Woodblock print. Kabuki. Actor Sakata Hangoro IV and Ichikawa Yaozo,crouching,as Kasodate Kannonbo and Fuwa Ban'emon. Nishiki-e on paper.",kabuki;actor/actress
1232,print,https://research.britishmuseum.org/collectionimages/AN00513/AN00513273_001_l.jpg,"Woodblock print. Kabuki. Actor Sawamura Sojuro and Segawa Kikunojo III seated, as Nagoya Sanza and Katsuragi. Nishiki-e on paper.",kabuki;actor/actress
1233,print,https://research.britishmuseum.org/collectionimages/AN00521/AN00521292_001_l.jpg,"Woodblock print. Kabuki. Actor, head and shoulders of Ichikawa Omezo as the yakko Ippei, with sword. Nishiki-e on paper.",servant/domestic worker;kabuki;arms/armour;actor/actress
