,Title,Source,Description,Keywords
641,painting,https://research.britishmuseum.org/collectionimages/AN00793/AN00793016_001_l.jpg,Painting in tanzaku format. Bust portrait of Nakayama Tomokuro (?) from a group of twenty-six paintings. Ink and colour on paper. Signed and sealed.,kabuki;actor/actress
642,Orandajin danjo no zu ・・ｿ・・ｭ・・・ｺｺ・・ｷ・･ｳ・ｹ・・・ｳ (Picture of a Dutch Man and Woman),https://research.britishmuseum.org/collectionimages/AN00440/AN00440858_001_l.jpg,Colour woodblock print. Dutch man and woman. Nagasaki-e.,scientific instrument
643,Sanjurokkasen ・ｸ・・・・・・ｭ・ｽｳ・・ｰ (Selection of Thirty-six Beauties) / Kiku mi - Kanpo koro fujin・・・・・ｦ・・・ｼ・ｯ・・ｿ・・・・ｩｦ・ｺｺ (Chrysanthemum Viewing - Women of around the Kanpo Era),https://research.britishmuseum.org/collectionimages/AN00434/AN00434510_001_l.jpg,Print. Plucking flowers on the sea shore. Colour woodblock printed.,
644,Sanjurokkasen ・ｸ・・・・・・ｭ・ｽｳ・・ｰ (Selection of Thirty-six Beauties) / Sozoro aruki - Meireki koro fujin・・・・・・・・・・・・・・・・・・・・・ｼ・・・・・ｦ・・・ｩｦ・ｺｺ (Strolling - Woman of around the Meireki Era),https://research.britishmuseum.org/collectionimages/AN00434/AN00434507_001_l.jpg,Print. Girl and child walking. Colour woodblock printed.,
645,Sanjuroku i kurabe ・ｸ・・・・・・ｭ・ｽｳ・・ｰ (The Thirty-six Beauties Compared) / Hatsune - Manji ji koro fujin・・・・・・ｳ・・ｼ・ｸ・・ｲｻ・・・ｩｦ・ｺｺ (First Warbler - Woman of around the Manji Era),https://research.britishmuseum.org/collectionimages/AN00434/AN00434500_001_l.jpg,"Print. Two girls, one with instrument. Colour woodblock printed.",music;bijin
646,Sanjurokkasen ・ｸ・・・・・・ｭ・ｽｳ・・ｰ (Selection of Thirty-six Beauties) / Amayadori - Tenna koro fujin・・・ｨ・・・・・ｩ・・・・・ｼ・､ｩ・・・・・・ｩｦ・ｺｺ (Shelter from the Rain - Woman of around the Tenna Era),https://research.britishmuseum.org/collectionimages/AN00434/AN00434495_001_l.jpg,Print. Young man and girl by tree. Colour woodblock printed.,
647,Sanjurokkasen ・ｸ・・・・・・ｭ・ｽｳ・・ｰ (Selection of Thirty-six Beauties) / Chogetsu - Jodai koro fujin・・・ｺ・・・・・ｼ・ｸ・・ｻ｣・・・ｩｦ・ｺｺ (Moon-viewing - Woman of around Ancient Times),https://research.britishmuseum.org/collectionimages/AN00434/AN00434491_001_l.jpg,Print. Girl by stream in the full moon. Colour woodblock printed.,
648,Sanjurokkasen ・ｸ・・・・・・ｭ・ｽｳ・・ｰ (Selection of Thirty-six Beauties) / Shobu - Enkyo koro fujin・・・・・・ｲ・・ｼ・ｻｶ・ｺｫ・・・ｩｦ・ｺｺ (Irises - Women of around the Enkyo Era),https://research.britishmuseum.org/collectionimages/AN00434/AN00434487_001_l.jpg,Print. Girl and iris beds. Colour woodblock printed.,flower;bijin
649,Sanjurokkasen ・ｸ・・・・・・ｭ・ｽｳ・・ｰ (Selection of Thirty-six Beauties) / Yu agari - Kansei koro fujin・・ｹｯ・・・・・・・・・・・ｼ・ｯ・・・ｿ・・・ｩｦ・ｺｺ (After the Bath - Woman of around the Kansei Era),https://research.britishmuseum.org/collectionimages/AN01595/AN01595409_001_l.jpg,Print. Girl and cat. Colour woodblock printed.,cat
650,Sanjurokkasen ・ｸ・・・・・・ｭ・ｽｳ・・ｰ (Selection of Thirty-six Beauties) / Tsujigimi - Onin koro fujin・・ｾｻ・・・・・ｼ・ｿ・・ｻ・・・・ｩｦ・ｺｺ (Street Prostitutes - Women of around the Onin Era),https://research.britishmuseum.org/collectionimages/AN00434/AN00434480_001_l.jpg,Print. Two girls and other figures in twilight. Colour woodblock printed.,
651,Sanjurokkasen ・ｸ・・・・・・ｭ・ｽｳ・・ｰ (Selection of Thirty-six Beauties) / Uzuki - Enkyo koro fujin・・・ｯ・・・・・ｼ・ｻｶ・ｺｫ・・・ｩｦ・ｺｺ (Fourth Month - Woman of around the Enkyo Era),https://research.britishmuseum.org/collectionimages/AN00434/AN00434476_001_l.jpg,Print. Girl on balcony in the moonlight. Colour woodblock printed.,
659,shunga / drawing,https://research.britishmuseum.org/collectionimages/AN00612/AN00612350_001_l.jpg,"Preparatory drawing (one of three) for erotic handscroll painting of famous kabuki actors in imagined scenes of lovemaking: Travellers under a tree watched by foxes. Ink on paper, with evidence of charcoal underdrawing.",eroticism/sex
660,print,https://research.britishmuseum.org/collectionimages/AN00422/AN00422023_001_l.jpg,Woodblock print. Bijinga. Courtesan as Daruma crossing the water on a reed. Nishiki-e on paper.,plant;bijin
661,print,https://research.britishmuseum.org/collectionimages/AN00422/AN00422098_001_l.jpg,"Woodblock print. Bijinga. Courtesan reclining in bed with books,her maid preparing pipe.Poem. Nishiki-e on paper.",smoking;servant/domestic worker;courtesan/prostitute;furniture/woodwork;book/newspaper;bijin
662,Yo-damme / Chushingura,https://research.britishmuseum.org/collectionimages/AN00529/AN00529234_001_l.jpg,"Woodblock print.Classical literature. Mitate. Act IV, two lovers parodying Oboshi Rikiya and Lady Kawayo. Nishiki-e on paper.",literature
663,Rokkasen,https://research.britishmuseum.org/collectionimages/AN00422/AN00422268_001_l.jpg,"Woodblock print. Popular culture. Poet Ariwara no Narihira on veranda of garden house contemplating moon,+ portrait inset.Poem. Nishiki-e on paper.",poet;moon;garden;domestic building
664,print,https://research.britishmuseum.org/collectionimages/AN00567/AN00567919_001_l.jpg,"Woodblock print. Popular culture. Young woman seated by open window overlooking a marsh with snipe, the book Tsure-zure-gusa by Yoshida Kenko on the floor. Nishiki-e on paper.",landscape;book/newspaper;bird
665,mitate-e / print,https://research.britishmuseum.org/collectionimages/AN00422/AN00422247_001_l.jpg,"Woodblock print.Mitate. Lovers seated on kotatsu playing flute, parody of Chinese Emperor Xuanzong and Yang Guifei, originally an e-goyomi. Nishiki-e on paper.",musical instrument;emperor/empress;yatsushi
666,Seiro Kinki Shoga (The Four Accomplishments in Yoshiwara),https://research.britishmuseum.org/collectionimages/AN00529/AN00529282_001_l.jpg,"Woodblock print. Bijinga. Mitate. Someyama of the Matsubaya with her kamuro playing the game of go, irises inset. Nishiki-e on paper.",flower;bijin;backgammon;kamuro;yatsushi
667,print,https://research.britishmuseum.org/collectionimages/AN00420/AN00420984_001_l.jpg,"Woodblock print.History, myth and legend. Watonai (alias Kokusenya or Coxinga), overpowering a tiger in a bamboo grove. Poem Tora maite nukitaru senri take no. Nishiki-e on paper.",myth/legend;mammal;history;bamboo
668,Fuzoku Mu-Tamagawa,https://research.britishmuseum.org/collectionimages/AN00612/AN00612165_001_l.jpg,"Woodblock print. Popular culture. Classical series. Gompachi dressed as komuso walking near river, with portrait of poet Kukai, inscription. Nishiki-e on paper.",poet
669,Seishu / Fuzoku Shiki Kasen,https://research.britishmuseum.org/collectionimages/AN00422/AN00422052_001_l.jpg,"Woodblock print. Popular culture. Lady en deshabille in open 2nd story room,with maid and poem. Nishiki-e on paper.",servant/domestic worker;literature
670,Sekidera / Furyu Nana-Komachi,https://research.britishmuseum.org/collectionimages/AN00612/AN00612154_001_l.jpg,"Woodblock print.Classical series. Popular culture. A young maid with a bucket on head leading child,with poem. Nishiki-e on paper.",servant/domestic worker;literature;child
671,Yoshiwara seiro bijin-awase,https://research.britishmuseum.org/collectionimages/AN00582/AN00582911_001_l.jpg,Woodblock print. Courtesan Oshu of the Hyogoya putting on finger plectrums to play the koto. Poem. Nishiki-e on paper.,theatre/theatrical life;courtesan/prostitute;musical instrument;music;dance
672,"Tokyo Koume hikifune yoru zu ・・ｱ・ｺｬ・ｰ・・｢・・・ｳ・・ｹ・､・・・ｳ (Barge-haulers at Night in Koume, Tokyo)",https://research.britishmuseum.org/collectionimages/AN00511/AN00511679_001_l.jpg,"Woodblock print. Boat at night, Tokyo.",canal scene;boat/ship
673,Hazuki ・・・・・・ (Eighth Month) / Bijin juni shi ・ｾ・・ｺｺ・・・・ｺ・・ｧｿ (Twelve Forms of Beauty),https://research.britishmuseum.org/collectionimages/AN00434/AN00434832_001_l.jpg,Print. Girl gazing at the moon. One of a set of prints for the twelve months. Colour woodblock printed.,bijin
674,Kisaragi ・ｦ・・・・ (Second Month) / Bijin juni shi ・ｾ・・ｺｺ・・・・ｺ・・ｧｿ (Twelve Forms of Beauty),https://research.britishmuseum.org/collectionimages/AN00434/AN00434828_001_l.jpg,Print. Woman and child in falling blossom. One of a set of prints for the twelve months. Colour woodblock printed.,bijin
675,Minazuki・・ｰｴ・・｡・・・ (Sixth Month) / Bijin juni shi・・ｾ・・ｺｺ・・・・ｺ・・ｧｿ (Twelve Forms of Beauty),https://research.britishmuseum.org/collectionimages/AN00434/AN00434824_001_l.jpg,Print. Seated girl and fan. One of a set of prints for the twelve months. Colour woodblock printed.,
676,Mutsubitsuki・・・ｦ・・・ (First Month) / Bijin juni shi・・ｾ・・ｺｺ・・・・ｺ・・ｧｿ (Twelve Forms of Beauty),https://research.britishmuseum.org/collectionimages/AN00434/AN00434821_001_l.jpg,Print. Girl and battledore. One of a set of prints for the twelve months. Colour woodblock printed.,sport/pastime
677,Kannazuki ・･・・・｡・・・ (Tenth Month) / Bijin juni shi・・ｾ・・ｺｺ・・・・ｺ・・ｧｿ (Twelve Forms of Beauty),https://research.britishmuseum.org/collectionimages/AN00434/AN00434712_001_l.jpg,Print. Girl by an open window in the rain. One of a set of prints for the twelve months. Colour woodblock printed.,bijin
678,Fumizuki ・・・・・・ (Seventh Month) / Bijin juni shi・・ｾ・・ｺｺ・・・・ｺ・・ｧｿ (Twelve Forms of Beauty),https://research.britishmuseum.org/collectionimages/AN00434/AN00434815_001_l.jpg,Print. Girl with bamboo. One of a set of prints for the twelve months. Colour woodblock printed.,bijin
679,Shiwasu ・ｸｫ・ｵｰ (Twelfth Month) / Bijin juni shi・・ｾ・・ｺｺ・・・・ｺ・・ｧｿ (Twelve Forms of Beauty),https://research.britishmuseum.org/collectionimages/AN00434/AN00434708_001_l.jpg,Print. Girl with broom in the snow. One of a set of prints for the twelve months. Colour woodblock printed.,
680,Tsuchigumo ・・・・・・・・・ (Earth Spider) / Yoshitoshi manga,https://research.britishmuseum.org/collectionimages/AN00761/AN00761470_001_l.jpg,"Colour woodblock print, diptych. Minamoto no Raiko tormented by the spider monster. Oban size.    Part 1",mythical figure/creature;go;arachnid
681,Sanjurokkasen ・ｸ・・・・・・ｭ・ｽｳ・・ｰ (Selection of Thirty-six Beauties) / Meiwa koro fujin・・・・・・､・・・・・・・・ｼ・・・・・・・・・ｩｦ・ｺｺ (Kutsuwaya - Women of around the Meiwa Era),https://research.britishmuseum.org/collectionimages/AN00434/AN00434536_001_l.jpg,Print. Courtesan and attendant. Colour woodblock printed.,courtesan/prostitute
682,Sanjurokkasen ・ｸ・・・・・・ｭ・ｽｳ・・ｰ (Selection of Thirty-six Beauties) / Jijo - Hotoku koro fujin・・ｾ・・･ｳ・・ｼ・ｮ・・ｾｳ・・・ｩｦ・ｺｺ (Lady-in-Waiting - Woman of around the Hotoku Era),https://research.britishmuseum.org/collectionimages/AN00434/AN00434533_001_l.jpg,Print. Lady on balcony and wisteria. Colour woodblock printed.,
683,Sanjurokkasen ・ｸ・・・・・・ｭ・ｽｳ・・ｰ (Selection of Thirty-six Beauties) / Shirabyoshi - Kenkyu koro fujin・・・ｽ・・・・ｭ・・・ｼ・ｻｺ・ｹ・・・・ｩｦ・ｺｺ (Shirabyoshi - Woman of around the Kenkyu Era),https://research.britishmuseum.org/collectionimages/AN00434/AN00434529_001_l.jpg,Print. Lady by open window. Colour woodblock printed.,
684,Sanjurokkasen ・ｸ・・・・・・ｭ・ｽｳ・・ｰ (Selection of Thirty-six Beauties) / Kyoho koro fujin - Yuzan・・・・・ｱｱ・・ｼ・ｺｫ・ｿ・・・・ｩｦ・ｺｺ (Mountain Excursion - Women of around the Kyoho Era),https://research.britishmuseum.org/collectionimages/AN00434/AN00434521_001_l.jpg,Print. Norimon (covered litter) halting. Colour woodblock-printed.,
685,Sanjurokkasen ・ｸ・・・・・・ｭ・ｽｳ・・ｰ (Selection of Thirty-six Beauties) / Mise - Kosho koro fujin・・ｦ・・ｸ・・｣・・・ｼ・ｺｷ・ｭ｣・・・ｩｦ・ｺｺ (Shop Shelves - Woman of around the Kosho Era),https://research.britishmuseum.org/collectionimages/AN00434/AN00434517_001_l.jpg,Print. Woman by draper's shop. Colour woodblock printed.,
686,Sanjurokkasen ・ｸ・・・・・・ｭ・ｽｳ・・ｰ (Selection of Thirty-six Beauties) / Yukun - Genna koro fujin・・・・・・・・・ｼ・・・・・・・・・ｩｦ・ｺｺ (Courtesan - Women of around the Genna Era),https://research.britishmuseum.org/collectionimages/AN00434/AN00434513_001_l.jpg,Print. Two girls and painted screen. Colour woodblock printed.,
687,Nagatsuki・・・ｪ・・・・・・ (Ninth Month) / Bijin juni shi ・ｾ・・ｺｺ・・・・ｺ・・ｧｿ (Twelve Forms of Beauty),https://research.britishmuseum.org/collectionimages/AN00434/AN00434843_001_l.jpg,Print. Girl and maple leaves. One of a set of prints for the twelve months. Colour woodblock printed.,
688,Yayoi ・ｼ･・・・ (Third Month) / Bijin juni shi ・ｾ・・ｺｺ・・・・ｺ・・ｧｿ (Twelve Forms of Beauty),https://research.britishmuseum.org/collectionimages/AN00434/AN00434839_001_l.jpg,Print. Girl and dolls. One of a set of prints for the twelve months. Colour woodblock printed.,toy
689,Uzuki ・・ｯ・・・ (Fourth Month) / Bijin juni shi ・ｾ・・ｺｺ・・・・ｺ・・ｧｿ (Twelve Forms of Beauty),https://research.britishmuseum.org/collectionimages/AN00434/AN00434834_001_l.jpg,Print. Girl and mosquito net. One of a set of prints for the twelve months. Colour woodblock printed.,bijin
690,Sanjurokkasen ・ｸ・・・・・・ｭ・ｽｳ・・ｰ (Selection of Thirty-six Beauties) / Hotaru-gari - Tenmei koro fujin・・・・・・ｩ・・ｼ・､ｩ・・・・・・ｩｦ・ｺｺ (Catching Fireflies - Woman of around the Tenmei Era),https://research.britishmuseum.org/collectionimages/AN00434/AN00434626_001_l.jpg,Print. Catching fireflies. Colour woodblock-printed.,insect;bijin
691,Sanjurokkasen ・ｸ・・・・・・ｭ・ｽｳ・・ｰ (Selection of Thirty-six Beauties) / Chanoyu - Hoei koro fujin・・・ｶ・・ｮ・ｹｯ・・ｼ・ｮ・・ｰｸ・・・ｩｦ・ｺｺ (Tea Ceremony - Woman of around the Hoei Era),https://research.britishmuseum.org/collectionimages/AN00434/AN00434620_001_l.jpg,Print. Stepping stones. Colour woodblock-printed.,
692,Sanjurokkasen ・ｸ・・・・・・ｭ・ｽｳ・・ｰ (Selection of Thirty-six Beauties) / Yuki-mi - Kanbun koro fujin・・・ｪ・ｦ・・・ｼ・ｯ・・・・・・・ｩｦ・ｺｺ (Snow-viewing - Woman of around the Kanbun Era),https://research.britishmuseum.org/collectionimages/AN00434/AN00434616_001_l.jpg,Print. Boat in winter. Colour woodblock-printed.,
693,Sanjurokkasen ・ｸ・・・・・・ｭ・ｽｳ・・ｰ (Selection of Thirty-six Beauties) / Eika - An'ei koro fujin・・ｩ・ｭ・・・ｼ・ｮ・・ｰｸ・・・ｩｦ・ｺｺ (Composing Poetry - Woman of around the An'ei era),https://research.britishmuseum.org/collectionimages/AN00434/AN00434611_001_l.jpg,"Print. Poetess, with maple in rain. Colour woodblock-printed.",poetry;bijin
694,Sanjurokkasen ・ｸ・・・・・・ｭ・ｽｳ・・ｰ (Selection of Thirty-six Beauties) / Hina asobi - Genbun koro fujin・・・ｲ・・ｪ・・・・・ｼ・・・・・・・・・ｩｦ・ｺｺ (Doll's Festival - Women of around the Genbun Era),https://research.britishmuseum.org/collectionimages/AN00434/AN00434596_001_l.jpg,Print. Set of dolls. Colour woodblock-printed.,toy
695,Sanjurokkasen ・ｸ・・・・・・ｭ・ｽｳ・・ｰ (Selection of Thirty-six Beauties) / Sakura ningyo - Enpo koro fujin・・｡・・ｺｺ・ｽ｢・・ｼ・ｻｶ・ｮ・・・・ｩｦ・ｺｺ (Puppets under the Cherry Trees - Woman of around the Enpo Era),https://research.britishmuseum.org/collectionimages/AN00434/AN00434605_001_l.jpg,Print. Tent under cherry tree. Colour woodblock-printed.,bijin
696,Sanjurokkasen ・ｸ・・・・・・ｭ・ｽｳ・・ｰ (Selection of Thirty-six Beauties) / Kesobumi - Genroku koro fujin・・・ｸ・・ｳ・・・・・ｼ・・・・ｦ・・・・ｩｦ・ｺｺ (The Love Letter - Woman of around the Genroku Era),https://research.britishmuseum.org/collectionimages/AN00434/AN00434586_001_l.jpg,Print. The letter. Colour woodblock-printed.,bijin
697,Sanjurokkasen ・ｸ・・・・・・ｭ・ｽｳ・・ｰ (Selection of Thirty-six Beauties) / Hisagi onna - Bun'an koro fujin・・・ｲ・・・・・・・･ｳ・・ｼ・・・・ｮ・・・・ｩｦ・ｺｺ (Hisagi Vendor - Woman of around the Bun'an Era),https://research.britishmuseum.org/collectionimages/AN00434/AN00434584_001_l.jpg,"Print. Woman with basket, and two boys with a dog. Colour woodblock-printed.",bijin;dog
698,Sanjurokkasen ・ｸ・・・・・・ｭ・ｽｳ・・ｰ (Selection of Thirty-six Beauties) / Mushi no oto - Kan'en koro fujin・・・ｫ・・ｮ・・ｳ・・ｼ・ｯ・・ｻｶ・・・ｩｦ・ｺｺ (The Sound of Insects - Woman of around the Kan'en Era),https://research.britishmuseum.org/collectionimages/AN00434/AN00434582_001_l.jpg,Print. A picnic. Colour woodblock-printed.,
699,Sanjurokkasen ・ｸ・・・・・・ｭ・ｽｳ・・ｰ (Selection of Thirty-six Beauties) / Yuhi - Keian koro fujin・・､・・・ｽ・・ｼ・・ｶ・ｮ・・・・ｩｦ・ｺｺ (Evening Sun - Woman of around the Keian Era),https://research.britishmuseum.org/collectionimages/AN00434/AN00434579_001_l.jpg,Print. The red sun. Colour woodblock-printed.,
700,Sanjurokkasen ・ｸ・・・・・・ｭ・ｽｳ・・ｰ (Selection of Thirty-six Beauties) / Kinoko-gari - Shotoku koro fujin・・・・・・ｩ・・ｼ・ｭ｣・ｾｳ・・・ｩｦ・ｺｺ (Gathering Mushrooms - Women of around the Shotoku Era),https://research.britishmuseum.org/collectionimages/AN00434/AN00434576_001_l.jpg,Print. Mushroom gatherers. Colour woodblock-printed.,
701,Sanjurokkasen ・ｸ・・・・・・ｭ・ｽｳ・・ｰ (Selection of Thirty-six Beauties) / Kanbo - Jokyo koro fujin・・ｦｳ・・・・ｼ・ｲ・・ｺｫ・・・ｩｦ・ｺｺ (Viewing a Waterfall - Women of around the Jokyo Era),https://research.britishmuseum.org/collectionimages/AN00434/AN00434573_001_l.jpg,Print. Group at a waterfall. Colour woodblock-printed.,
702,Sanjurokkasen ・ｸ・・・・・・ｭ・ｽｳ・・ｰ (Selection of Thirty-six Beauties) / Senpatsu - Shoho koro fujin・・ｴ・・ｫｪ・・ｼ・ｭ｣・ｿ・・・・ｩｦ・ｺｺ (Washing the Hair - A Woman of around the Shoho Era),https://research.britishmuseum.org/collectionimages/AN00434/AN00434570_001_l.jpg,Print. Family party. Colour woodblock-printed.,
703,Sanjurokkasen ・ｸ・・・・・・ｭ・ｽｳ・・ｰ (Selection of Thirty-six Beauties) / Hanami - Bunsei koro fujin・・・ｱ・ｦ・・・ｼ・・・・・ｿ・・・ｩｦ・ｺｺ (Cherry-blossom Viewing: Women of around the Bunsei Era),https://research.britishmuseum.org/collectionimages/AN00434/AN00434566_001_l.jpg,Print. Blue umbrellas. Colour woodblock-printed.,
704,Sanjurokkasen ・ｸ・・・・・・ｭ・ｽｳ・・ｰ (Selection of Thirty-six Beauties) / Shiohi - Bunka koro fujin・・ｱ・・ｹｲ・・ｼ・・・・・・・・・ｩｦ・ｺｺ (Low-tide - Women of around the Bunka Era),https://research.britishmuseum.org/collectionimages/AN00434/AN00434562_001_l.jpg,Print. Catching fish. Colour woodblock-printed.,fisherman/fishing
705,Sanjurokkasen ・ｸ・・・・・・ｭ・ｽｳ・・ｰ (Selection of Thirty-six Beauties) / Tabiji - Genko koro fujin・・・・・ｷｯ・・ｼ・・・・ｼ・・・・ｩｦ・ｺｺ (On the Road - Woman of around the Genko Era),https://research.britishmuseum.org/collectionimages/AN00434/AN00434556_001_l.jpg,Print. Travellers. Colour woodblock-printed.,
706,Sanjurokkasen ・ｸ・・・・・・ｭ・ｽｳ・・ｰ (Selection of Thirty-six Beauties) / Koto shirabe - Koka koro Nagoya fujin・・・ｴ・・・・・・・・ｹ・・ｼ・ｼ・・・・・・・・・・・､・ｱ・・ｩｦ・ｺｺ (Tuning the Koto - A Nagoya Woman of around the Koka era),https://research.britishmuseum.org/collectionimages/AN00434/AN00434551_001_l.jpg,Print. Girl playing koto. Colour woodblock-printed.,music
707,Sanjurokkasen ・ｸ・・・・・・ｭ・ｽｳ・・ｰ (Selection of Thirty-six Beauties) / Temari - Keicho koro fujin・ ・・・・・・・ｼ・・ｶ・・ｷ・・・ｩｦ・ｺｺ (Playing Ball - Women of around the Keicho Era),https://research.britishmuseum.org/collectionimages/AN00434/AN00434545_001_l.jpg,Print. Three girls and willow tree. Colour woodblock-printed.,
708,Sanjurokkasen ・ｸ・・・・・・ｭ・ｽｳ・・ｰ (Selection of Thirty-six Beauties) / Chaju onna - Horeki koro fujin・・・ｶ・・・・･ｳ・・ｼ・ｮ・・・ｦ・・・ｩｦ・ｺｺ (Teahouse Waitress - Woman of around the Horeki Era),https://research.britishmuseum.org/collectionimages/AN00434/AN00434541_001_l.jpg,Print. Girl and pigeons. Colour woodblock-printed.,
709,Akasaka Kinokunizaka ・ｵ､・・・・ｴ・ｼ・・・ｽ・・・ (Kinokuni Hill at Akasaka),https://research.britishmuseum.org/collectionimages/AN00751/AN00751975_001_l.jpg,"Colour woodblock print, from an album. Scene of Tokyo.",
710,shunga / print,https://research.britishmuseum.org/collectionimages/AN00830/AN00830829_001_l.jpg,"Colour woodblock print. Lovers with quail in a cage, woman fulling cloth.",merchant/shopkeeper;eroticism/sex;bird
711,Sugawara Denju Tenarai,https://research.britishmuseum.org/collectionimages/AN00602/AN00602523_001_l.jpg,"Colour woodblock print from an album of 104 sheets. The actor Arashi Kitsusaburo II as Sukune Taro in the play (Sugawara's Secrets of Calligraphy), performed at the Naka theatre in the 11th month, 1822. Signed.",kabuki;actor/actress
712,print,https://research.britishmuseum.org/collectionimages/AN00602/AN00602521_001_l.jpg,Colour woodblock print from an album of 104 sheets. The actor Arashi Kitsusaburo II as Sasaki Tan'emon. Signed.,kabuki;actor/actress
713,print,https://research.britishmuseum.org/collectionimages/AN00601/AN00601846_001_l.jpg,Colour woodblock print from an album of 104 sheets. The actor Ogawa Kichitaro I as the pack-horse driver Yosaku. Signed.,kabuki;actor/actress;horse/ass
714,print,https://research.britishmuseum.org/collectionimages/AN00601/AN00601686_001_l.jpg,Colour woodblock print from an album of 104 sheets. The actor Nakamura Utaemon III as Ishikawa Goemon. Signed.,kabuki;actor/actress
715,print,https://research.britishmuseum.org/collectionimages/AN00601/AN00601651_001_l.jpg,Colour woodblock print from an album of 104 sheets. The actors Arashi Kitsusaburo II as Miura Matazo (top) and Onoe Umezo as Toranosuke (bottom). Signed.,kabuki;actor/actress
716,print,https://research.britishmuseum.org/collectionimages/AN00601/AN00601650_001_l.jpg,Colour woodblock print from an album of 104 sheets. The actor Nakamura Utaemon III as Mino no Shokuro. Signed.,kabuki;actor/actress
717,print,https://research.britishmuseum.org/collectionimages/AN00601/AN00601646_001_l.jpg,Colour woodblock print from an album of 104 sheets. The actor Arashi Kitsusaburo II as Tsukimoto Hajimenosuke Signed.,kabuki;actor/actress
718,print,https://research.britishmuseum.org/collectionimages/AN00601/AN00601643_001_l.jpg,Colour woodblock print from an album of 104 sheets. Nakamura Utaemon III as Yakambei. Signed.,kabuki;actor/actress
719,print,https://research.britishmuseum.org/collectionimages/AN00583/AN00583003_001_l.jpg,Colour woodblock print from an album of 104 sheets. The actor Arashi Kitsusaburo II (right) as Gofukuya Jubei. Signed.,kabuki;actor/actress
720,print,https://research.britishmuseum.org/collectionimages/AN00583/AN00583000_001_l.jpg,Colour woodblock print from an album of 104 sheets. The actor Nakamura Utaemon III making a speech (kojo) to the audience at a Kyoto theatre. Signed.,theatre/theatrical life;kabuki;audience/assembly;actor/actress
721,print,https://research.britishmuseum.org/collectionimages/AN00582/AN00582996_001_l.jpg,"Colour woodblock print from an album of 104 sheets. The actor Arashi Kitsusaburo II as Hotei Ichiemon, one of the 'Five Chivalrous Men', (Gonin otoko). Signed.",kabuki;actor/actress
722,shunga,https://research.britishmuseum.org/collectionimages/AN00583/AN00583073_001_l.jpg,"Colour woodblock print, shunga. Fisherman making love to a woman in a boat on the Sumida River, hidden by a yotsude-ami fishing net.",fisherman/fishing;shunga;boat/ship
723,kakemono-e,https://research.britishmuseum.org/collectionimages/AN00645/AN00645104_001_l.jpg,"Colour woodblock print with some hand-colouring, ishizuri-e. Hawk with chick perched on tree peony by torrent.",bird and flower
