,Title,Source,Description,Keywords
1528,triptych print,https://research.britishmuseum.org/collectionimages/AN00419/AN00419922_001_l.jpg,"Woodblock print, triptych print. Six actors under umbrellas, each bearing two identifying crests (from right): Segawa Kikujiro, Arashi Wakano II, Nakamura Tomijuro, Sanogawa Ichimatsu, Nakamura Kumetaro and Ichimura Kamezo. With three poems. Printed three sets of blocks on to one piece of paper. Inscribed, signed and marked.",kabuki;actor/actress
1529,print,https://research.britishmuseum.org/collectionimages/AN00418/AN00418835_001_l.jpg,"Woodblock print. Two actors imitating shojo; one holding ladle and riding on huge water-turtle;  other holding giant sake-cup; great sake jar between them; mallet motif on kimono; cranes, bamboo, plum blossom and pine in background. With hand-colouring and applied metal dust. Signed and marked.",kabuki;actor/actress
1530,print,https://research.britishmuseum.org/collectionimages/AN00418/AN00418829_001_l.jpg,"Woodblock print. Popular gods Ebisu, Hotei and Daikoku in Treasure Ship accompanied by two Chinese boys: Ebisu, catching tax fish; Hotei with his Chinese fan; Daikoku with his mallet, flanked by casks of sake. With poem. With hand-colouring and applied metal dust. Inscribed and marked.",seven gods of good fortune
1531,Uki-e Nihonbashi Tori-cho no zu (Perspective Picture of Tori-cho in Nihonbashi) / Uki-e,https://research.britishmuseum.org/collectionimages/AN00533/AN00533147_001_l.jpg,"Woodblock print. Uki-e. Townscape. Tori-cho street leading to bridge, figures flying kites, shops, with decorative border. Nishiki-e on paper.",kite/kite flying;uki-e;shop;bridge
1532,Tenpozan Suehirobashi tsuki yo no zu ・､ｩ・ｿ・・ｱｱ・・ｫ・ｺ・・ｩ・・・・・､・・・ｮ・・ｳ (Suehiro Bridge near Mt. Tenpo on a Moonlit Night),https://research.britishmuseum.org/collectionimages/AN00531/AN00531428_001_l.jpg,Woodblock print.Townscape. Classical series. Boat being punted under bridge. Nishiki-e on paper.,landscape;bridge;boat/ship
1533,Hinagata wakana no hatsumoyo ・・・・ｽ｢・・･・・・・・ｮ・・・・ｨ｡・ｧ・ (A Pattern Book of Fresh Model Designs),https://research.britishmuseum.org/collectionimages/AN00513/AN00513377_001_l.jpg,"Woodblock print. Bijinga. Ogiya-uchi Takikawa, the courtesan, with her two kamuro, Onami and Menami, two others. Nishiki-e on paper.",courtesan/prostitute;bijin;kamuro
1534,print,https://research.britishmuseum.org/collectionimages/AN00440/AN00440717_001_l.jpg,"Woodblock print. Actors Nakamura Matsue and Segawa Kikunojo as Hanshichi and Ohana, standing and looking at each other over shoulders. Inscribed, marked, signed and sealed.",kabuki;actor/actress
1535,Ryojunko-gai daikaisen zu ・・・・・・ｸｯ・､・・､ｧ・ｵｷ・・ｦ・・ｳ (Depiction of a Great Sea Battle outside the Port of Lushun [Port Arthur].),https://research.britishmuseum.org/collectionimages/AN00248/AN00248969_001_l.jpg,Woodblock. Contemporary history. Naval battle at port of Lushun. Nishiki-e on paper.,naval;history;harbour/port;battle
1536,Oatari kyogen ・､ｧ・ｽ・・・・・ｨ / Kan Shojo ・・・・ｸ・・・ｸ,https://research.britishmuseum.org/collectionimages/AN01293/AN01293707_001_l.jpg,"Colour woodblock print, oban, from a series illustrating great stage successes (・・Oatari kyogen・・). The kabuki actor Ichikawa Danjuro VII as Kan Shojo, (also called Sugawara no Michizane), in the play ・・Sekai no hana Sugawara denju・・ (???????) by Tsuruya Nanb",kyogen
1537,print,https://research.britishmuseum.org/collectionimages/AN00510/AN00510487_001_l.jpg,"Woodblock print. Man and boy at tea-stall at Mimeguri Inari shrine by a pond with irises, looking at votive tablet (hono) with portrait of kabuki actor Ichikawa Danjuro IV, with poem. Nishiki-e on paper.",tea production/trade;kabuki;child;actor/actress
1538,uki-e / print,https://research.britishmuseum.org/collectionimages/AN00418/AN00418007_001_l.jpg,"Woodblock print, ukie. Novelist Murasaki Shikibu looking out from Ishiyama Temple on Lake Biwa; seven of 'Eight Views of Lake Biwa' in background. With hand-colouring. Inscribed, signed and sealed.",uki-e;literature
1539,Ichikawa Ebizo as Saito Dosan ・ｸ・・ｷ・・ｵｷ・・・・ｵ・・ｮ・・・・・､・・・・ｸ・,https://research.britishmuseum.org/collectionimages/AN00605/AN00605390_001_l.jpg,"Woodblock print, diptych. Kabuki. Actor Ichikawa Ebizo as Saito Dosan with musket, Iwai Shijaku as Princess Yaegaki with helmet of Takeda Shingen, flames. Nishiki-e on paper.",kabuki;arms/armour;actor/actress
1540,Nakamura Shikan as Gotobei ・ｸｭ・・・・・・・ｿｫ・・ｮ・ｺ・・・・・・ｵ・｡・,https://research.britishmuseum.org/collectionimages/AN00834/AN00834939_001_l.jpg,"Woodblock print. Kabuki. Actor Nakamura Shikan as Gotobei, a drunkard, fans above.",kabuki;actor/actress
1541,painting,https://research.britishmuseum.org/collectionimages/AN00751/AN00751969_001_l.jpg,"Painting, fragment of handscroll. The first Dutch ship to arrive at Nagasaki in 1818. Ink and colours on silk. Signed and sealed.",dutch;boat/ship
1542,print,https://research.britishmuseum.org/collectionimages/AN00521/AN00521716_001_l.jpg,"Kappazuri-e (stencil-coloured woodblock print), showing imaginary trial of strength (kubihiki) between the Osaka kabuki actors Nakamura Utaemon III in the role of Shakkyo (right front) and Arashi Kichisaburo II as Akizuki Daizen (left front), watched by Ichikawa Ebijuro I as Miura Arajiro (right back), Ichikawa Monnosuke III as the umpire (centre back) and Arashi Sangoro III as Dankuro (centre left).  Inscribed.",kabuki;actor/actress
1543,shunga / print,https://research.britishmuseum.org/collectionimages/AN00583/AN00583012_001_l.jpg,Woodblock print with five stencil-printed colours (kappazuri). Erotic scene (shunga). The kabuki actor Ichikawa Danzo IV and an unidentified female impersonator beside an open veranda.,kabuki;eroticism/sex;actor/actress
1544,painting / hanging scroll,https://research.britishmuseum.org/collectionimages/AN00020/AN00020817_001_l.jpg,"Hanging scroll; ink and colour on paper. Scene at the Ichiriki-ya Tea House, Gion, from Act Seven of 'Chushingura' (Treasury of the 47 Loyal Retainers). The actors Nakamura Noshio II (Ranko, 1759-1800) as Okaru (top), Arashi Hinasuke I (Koroku III, Minshi 1741-96) as Oboshi Yuranosuke (centre), and Asao Tamejuro I (Okuyama, 1735-1804) as Kudayu (bottom). Signed and sealed.",kabuki;actor/actress
1548,Omi hakkei zenzu Ishiyama kara miru ・ｿ・・ｱ・・・ｫ・・ｯ・・ｨ・・ｳ・・ｳ・ｱｱ・・・・・・・ｦ・・・・,https://research.britishmuseum.org/collectionimages/AN00861/AN00861123_001_l.jpg,"Complete set of eighteen cherrywood printing blocks for the triptych 1909,0118,0.4.",
1549,shunga / drawing,https://research.britishmuseum.org/collectionimages/AN00612/AN00612349_001_l.jpg,"Preparatory drawing (one of three) for erotic handscroll painting of famous kabuki actors in imagined scenes of lovemaking: Workman and woman next to a bed-quilt. Ink on paper, with evidence of charcoal underdrawing.",kabuki;eroticism/sex;actor/actress
1550,Nitakara-gura kabe no mudagaki ・・ｷ・ｮ・・・ｵ・｣・・・ｮ・・・・・・ｸ (Storehouse of Treasured Goods: Scribblings on the Wall),https://research.britishmuseum.org/collectionimages/AN00587/AN00587345_001_l.jpg,"Woodblock print, oban tate-e. Grafitti characters of seven kabuki actors: Bando Hikosaburo IV (top right), Bando Mitsugoro IV (bottom right), Onoe Matsusuke III (top centre), Fujikawa Kayu III (centre), Otani Tomoemon IV (top left), Nakamura Gennosuke II (centre left), Azuma Tozo V (bottom left).",kabuki;actor/actress
1551,"Hanawa Daimyﾅ・jin go-shintai ・・ｱ・ｼｪ・､ｧ・・・・･・・・・・･・・ｽ・ no14 (Manifestation of the Great Deity Hanawa, no. 14)",https://research.britishmuseum.org/collectionimages/AN01118/AN01118816_001_l.jpg,"Painting, shikishi. The deity Fudo Myoo seated on a rock by a waterfall, with a young girl climbing towards him. Ink and colour on board.",deity;buddhism
1559,"Barber's Shop, Koyasuhama",https://research.britishmuseum.org/collectionimages/AN00225/AN00225262_001_l.jpg,Woodblock print. Barber's shop in Koyasuhama. Colours. Annotations and seal.,society/human life
1560,triptych print,https://research.britishmuseum.org/collectionimages/AN00690/AN00690203_001_l.jpg,"Colour woodblock-printed triptych. Tenno Festival: great street procession outside Tenno shrine in Edo; two floats of lion-dogs carried by bearers in centre; tree covered in devotional prayer-slips in left; sake barrels in right. Inscribed, signed, sealed and marked.",procession;festival
1566,(Santo yakusha) Masukagami (・ｸ・・・ｽ・ｿｳ・・ｪ) ・・ｾ・・・・・・・・・・・ｿ (Mirror-perfect Reflections of Actors in the Three Cities),https://research.britishmuseum.org/collectionimages/AN00189/AN00189128_001_l.jpg,,kabuki;actor/actress;kyoka
1568,Sensu seiran ・・・・ｭ・・・ｴ・ｵ・ (Clearing Storm of the Folding Fan) / Furyu zashiki hakkei ・｢ｨ・ｵ・・ｺｧ・・ｷ・・ｫ・・ｯ (Eight Fashionable Views of Interiors),https://research.britishmuseum.org/collectionimages/AN00509/AN00509694_001_l.jpg,"Shunga. (Eight Elegant Parlour Views).(Clearing Storm of the Folding Fan). Fan seller and woman on a verandah, with a small boy playing with water from a goldfish tank. Woodblock-printed. Inscribed.",street-trader;eroticism/sex;child
1569,shunga / print,https://research.britishmuseum.org/collectionimages/AN00701/AN00701453_001_l.jpg,Shunga. Lovers with a baby. Yellow ground. Woodblock-printed,eroticism/sex;child
1570,"Flower, bird, wind, and moon (・・ｱ・ｳ･・｢ｨ・・・). Tori-oi and Daikagura street performers (・ｳ･・ｿｽ・・・・・ｨ・､ｪ・･・・･ｽ)",https://research.britishmuseum.org/collectionimages/AN00535/AN00535804_001_l.jpg,"Woodblock print.Music, dance and drama. Street-entertainer. Poem. Nishiki-e on paper.",theatre/theatrical life;music;dance;acrobat/street-performer
1573,Karasaki ya-u ・・・・ｴ・・､・・・ｨ (Night Rain at Karasaki) / Omi hakkei no uchi ・ｿ・・ｱ・・・ｫ・・ｯ・ｹ・・・・ (Eight Views of Lake Biwa),https://research.britishmuseum.org/collectionimages/AN00154/AN00154435_001_l.jpg,"Woodblock. General subject - townscape, urban, classical series. Night rain at Karasaki with the ancient pine green.1 of 2. Nishiki-e on paper.",landscape
1576,Ichikawa Yaozo II as Oyamada hyakusho Yomosaku (・ｺ・・ｻ｣・・ｮ・ｸ・・ｷ・・・ｫ・・ｾ・・ｵ・・ｮ・ｰ・・ｱｱ・・ｰ・・ｾ・ｧ・・ｸ・・・・・ｽ・),https://research.britishmuseum.org/collectionimages/AN00424/AN00424599_001_l.jpg,"Woodblock print. Kabuki. Actor Ichikawa Yaozo as farmer Oyamada looking at reflection in water pail, compared to handbill likeness. Inscription. Nishiki-e on paper.",vessel;kabuki;farmer/farm worker;actor/actress
1577,triptych print,https://research.britishmuseum.org/collectionimages/AN00690/AN00690198_001_l.jpg,Colour woodblock print triptych. Newly published brocade first night: Audience arriving at Kabuki theatre; three women on right wearing hair-cloths; man carrying boxes of noodles on left; two doormen standing with fans advertising appearance of Danjuro (left) and Sojuro (right); performance glimpse through entrance. 1 of 2 impressions. Inscribed and signed.,theatre/opera house;kabuki
1583,print,https://research.britishmuseum.org/collectionimages/AN00525/AN00525333_001_l.jpg,"Colour woodblock print. Bijinga. Ofuji handing over handscroll to Okita. Nishiki-e on paper. Signed, sealed and marked.",bijin
1585,Matsumoto Koshiro IV as Shigetada(?) and Ichikawa Monnosuke II as Atake Dainichibo(?) ・・・・ｻ｣・・ｮ・・ｾ・・ｬ・ｹｸ・・・・・・・・ｮ・・・・ｿ(?)・・ｨ・ｺ・・ｻ｣・・ｮ・ｸ・・ｷ・・・・ｹ・・・ｩ・・ｮ・・・・・・・・・・､ｧ・・･・・・(?),https://research.britishmuseum.org/collectionimages/AN00513/AN00513336_001_l.jpg,"Woodblock print, diptych. Kabuki. Actors Matsumoto Koshiro as high-ranking samurai meeting Ichikawa Monnosuke holding sword with background of bamboo. Nishiki-e on paper. This image is 1915,0823,0.658.1",samurai;kabuki;bamboo;arms/armour;actor/actress
1586,"A beauty dancing ・・Nunozarashi・・・・・ｸ・・・・・・・・・・・・・・・・ｸ・・・｣・・ｦ・・・・・・・ｾ・・ｺｺ / Oshie-gata・・ (・・・・・・・ｵｵ・ｽ｢, Designs for Patchwork Pictures)",https://research.britishmuseum.org/collectionimages/AN00513/AN00513040_001_l.jpg,"Woodblock print.Music, dance and drama.  Girl dancing the nuno-zarashi dance with two silken streamers. Nishiki-e on paper.",theatre/theatrical life;music;dance
1587,kakemono-e,https://research.britishmuseum.org/collectionimages/AN00645/AN00645026_001_l.jpg,"Colour woodblock print with some hand-colouring, ishizuri-e. Dragon and tige with clouds and sea and tiger with bamboo. Signed.",mammal;dragon
1588,triptych print,https://research.britishmuseum.org/collectionimages/AN00693/AN00693252_001_l.jpg,"Colour woodblock-printed triptych. Picnic on beach: Young men and women of daimyo class serving sake from lacquered picnic set on beach; fishermen bring in their catch in background. Signed, marked and sealed.",picnic;beach scene
1589,mitate-e / diptych print,https://research.britishmuseum.org/collectionimages/AN00595/AN00595739_001_l.jpg,"Colour woodblock-printed diptych, mitate-e. Seven Edo courtesans and entertainers, with their attendants; one reading love-letter; in garden on outskirts of city, a parody of the Seven Sages of the Bamboo Grove. Signed, sealed and marked.",travesty;courtesan/prostitute;history;bijin;yatsushi
1590,"Seiobo Ogiya uchi Takikawa, Onami, Menami・・･ｿ・・・・ｯ・・・・・・ｱ・・・・・ｻ・・ｷ・・・・・・・ｪ・・ｿ・・・・・・ｪ・・ｿ (Seiobo: Takikawa of the Ogiya, [kamuro:] Onami, Menami) / Enchu hassen・・・ｶ・ｸｭ・・ｫ・ｻ・ (Eight Immortals in the Art of Love)",https://research.britishmuseum.org/collectionimages/AN00529/AN00529223_001_l.jpg,"Colour woodblock print. Courtesan Takikawa as Seiobo, Chinese fairy queen; kamuro holding peaches; with Chinese style fan and incense-burner. Nishiki-e on paper. Inscribed, signed, sealed and marked.",courtesan/prostitute;kamuro
1591,triptych print,https://research.britishmuseum.org/collectionimages/AN00689/AN00689667_001_l.jpg,"Colour woodblock-printed triptych. Scene from play 'An Example of Noble Womanhood': Kogonosuke standing on far bank gazing at his lover Hinadori; Hinadori standing on near veranda; palace in style of contemporary Edo house of entertainment with cherry-blossom in garden. Signed, sealed and marked.",theatre/theatrical life
1592,Rosei kantan issui no yume ・ｭｯ・・・・ｶ・ｽｭ・ｸ・・・・､｢ (Lu Sheng's Transient Dream at Handan),https://research.britishmuseum.org/collectionimages/AN00632/AN00632506_001_l.jpg,"Colour woodblock-printed triptych, mitate-e. Parody of Lu Sheng's (J: Rosei) dream, here dreaming of the pleasures of contemporary Edo (Tokyo) at Shinagawa: Greeting sunrise in boat on Edo Bay, feasting in restaurant, being entertained to classical music; joining procession of top-rank courtesan under cherry-blossom. Inscribed, signed and marked.",courtesan/prostitute;pleasure quarters;myth/legend;yatsushi
1593,Taiko gosai rakuto yukan no zu・・､ｪ・・､・ｺ・・ｦｻ・ｴ・・・ｱ・・・・ｦｳ・ｹ・・・ｳ (Picture of Hideyoshi and his Five Wives Viewing the Cherry-blossom at Higashiyama),https://research.britishmuseum.org/collectionimages/AN00694/AN00694493_001_l.jpg,"Colour woodblock-printed triptych. Toyotomi Hideyoshi at flower-viewing party with his wife (Kita no Mandokoro), concubines (Lady Kana, Lady Sanjo, Ishida Mitsunari, Lady Matsu no Maru, Okoi-no-kata, Lady Yodo) and attendants. Nishiki-e on paper. Inscribed, signed and marked.",ruler;picnic
1594,Ichikawa Komazo III as Ono Sadakuro ・ｸ・・ｻ｣・・ｮ・ｸ・・ｷ・・ｫ・・ｺ・・・ｵ・・ｮ・・ｧ・ｮ・・ｹ・・・・,https://research.britishmuseum.org/collectionimages/AN00513/AN00513036_001_l.jpg,Woodblock print. Kabuki. Head and shoulders of actor Ichikawa Komazo under an umbrella. Nishiki-e on paper.,kabuki;actor/actress
1595,Karasaki ya-u ・・・・ｴ・・､・・・ｨ (Night Rain at Karasaki) / Omi hakkei no uchi ・ｿ・・ｱ・・・ｫ・・ｯ・ｹ・・・・ (Eight Views of Lake Biwa),https://research.britishmuseum.org/collectionimages/AN00154/AN00154515_001_l.jpg,"Woodblock. General subject - landscape, rural, classical series. Night rain at Karasaki.Boats,trees.1 of 2 impressions. Nishiki-e on paper.",tree/bush;landscape
1596,print / hashira-e,https://research.britishmuseum.org/collectionimages/AN01293/AN01293789_001_l.jpg,"Colour woodblock, pillar print (・・hashira-e・・). A depiction of Hayano Kanpei sheltering beneath a pine tree in the rain; he is out hunting with a shotgun over one shoulder and a sedge hat in one hand. Along the highway in the distance is the evil ronin Ono",kabuki
1597,triptych print,https://research.britishmuseum.org/collectionimages/AN00693/AN00693315_001_l.jpg,"Woodblock print, triptych. Kabuki. Actors Onoe Gacho and Sawamura Shozan I as Chinese chamberlains with Segawa Rokyo as princess playing the flute. Nishiki-e on paper.",prince/princess;trade/occupation;musical instrument;kabuki;actor/actress
1598,triptych print,https://research.britishmuseum.org/collectionimages/AN00693/AN00693304_001_l.jpg,"Woodblock print, triptych. Kabuki. Three actors, Bando Mitsugoro as Watanabe no Tsuna with banner, Ichikawa Omezo as Somano Yoshikado, Iwai Hanshiro as Koyuki. Nishiki-e on paper.",kabuki;actor/actress
1599,Fuzoku mu-tamagawa ・｢ｨ・ｿ・・・ｭ・・・・ｷ・ (The Six Crystal Rivers Up-to-date),https://research.britishmuseum.org/collectionimages/AN00612/AN00612164_001_l.jpg,"Colour woodblock pillar print, hashira-e. Prostitute on veranda in night attire; series title and poem of autumnal melancholy in long poem-slip above her head; poem card of Kinuta River with portrait of classical poetess next to it. Inscribed and signed.",courtesan/prostitute;literature
1600,triptych print,https://research.britishmuseum.org/collectionimages/AN00241/AN00241461_001_l.jpg,"Woodblock, triptych. History, myth and legend. The revenge of the Taira ghosts on Yoshitsune and his men in Daimotsu bay.Inscription. Nishiki-e on paper.",myth/legend;history
1601,surimono / print,https://research.britishmuseum.org/collectionimages/AN00607/AN00607544_001_l.jpg,"Colour woodblock print, surimono. Formal portrait of actor Arashi Kichisaburo II, commemorating changing name to Kitsusaburo, dressed in formal attire with sword-bearer and elbow-rest. With eight congratulatory poems. Nishiki-e on paper with applied lacquer and mother-of-pearl. Inscribed, signed and sealed.",kabuki;actor/actress
1602,Matsumoto Koshiro V as the spirit of Tarobo ・ｺ・・ｻ｣・・ｮ・・ｾ・・ｬ・ｹｸ・・・・・・・・ｮ・､ｪ・・・・・・・・ｮ・・・,https://research.britishmuseum.org/collectionimages/AN00537/AN00537402_001_l.jpg,"Woodblock print.History, myth and legend. Spirit of Tarobo, King of the Tengu. Nishiki-e on paper.",spirit;myth/legend;history
1603,No 35 Narai-yado meisanten no zu・・ｸ・・・・・ｺ・・・･・・・ｯ・ｺ・・ｮｿ・・・・・｣・ｺ・・ｹ・・・ｺ (The souvenir shop at the Narai stop) / Kisokaido・・・ｨ・・ｾ・｡・・・・,https://research.britishmuseum.org/collectionimages/AN00533/AN00533298_001_l.jpg,"Colour woodblock print. Souvenir shop at Narai stop on Kisokaido: travellers resting at shop front in mountains. One of Eisen's twenty-four prints from series of seventy-one on posting-stations along inland route between Edo and Kyoto. Inscribed, signed, marked and sealed.",traveller/travel;landscape
1604,Seba ・ｴ・・ｦｬ / Kisokaido rokujukyu-tsugi no uchi ・・ｨ・・ｽ・ｵｷ・・・・・ｭ・・ｾ・ｹ・・ｬ｡・ｹ・・・・ (From the sixty-nine Posting Stations on the Kisokaido Road),https://research.britishmuseum.org/collectionimages/AN00155/AN00155390_001_l.jpg,"Woodblock. General subject - landscape, rural. River,night,moon,boat,figures,buildings. Nishiki-e on paper.",moon;landscape;boat/ship
1605,Ichikawa Yaozo III as Yoshitsune ・ｸ・・ｻ｣・・ｮ・ｸ・・ｷ・・・ｫ・・ｾ・・ｵ・・ｮ・ｾｩ・ｵ・,https://research.britishmuseum.org/collectionimages/AN00529/AN00529213_001_l.jpg,"Woodblock print. Kabuki. Actor Ichikawa Yaozo, possibly as Yoshitsune, with a white studded band round his forehead. Nishiki-e on paper.",kabuki;actor/actress
1606,print,https://research.britishmuseum.org/collectionimages/AN00522/AN00522962_001_l.jpg,"Woodblock print. Kabuki. Two actors as a man and a woman, the man with his hand up his sleeve. Nishiki-e on paper.",kabuki;actor/actress
1607,print,https://research.britishmuseum.org/collectionimages/AN00533/AN00533052_001_l.jpg,Woodblock print. Kabuki. Actors Segawa Kikunojo as Sangoku Kojoro and Arashi Sampachi as her brother Kujuro. Nishiki-e on paper.,kabuki;actor/actress
1608,Nishiki-ori Utamaro-gata shin-moyo ・・ｦ・ｹ・・ｭ・・ｺｿ・ｽ｢・・ｰ・ｨ｡・ｧ・ (New Brocade Patterns in Utamaro's Style),https://research.britishmuseum.org/collectionimages/AN00528/AN00528081_001_l.jpg,Colour woodblock print. Bijinga. Courtesan kneeling with hands grasping outer robe; outer robe left in white without outline. Inscribed and signed.,courtesan/prostitute;bijin
1609,Matsumoto Koshiro IV as Sekitori Katsuragawa no Choemon(?) and Sakata Hangoro III ・・・・ｻ｣・・ｮ・・ｾ・・ｬ・ｫ・・・・・・・・・ｮ・・｢・・・・｡・・ｷ・・・ｷ・・ｳ・｡・・・(?)・・ｨ・ｸ・・ｻ｣・・ｮ・・・・・ｰ・・・・ｺ・・・・,https://research.britishmuseum.org/collectionimages/AN00510/AN00510825_001_l.jpg,"Woodblock print, diptych. Kabuki. Actors Matsumoto Koshiro and Sakata Hangoro as sumo wrestlers about to engage on wharf by sea. Nishiki-e on paper.  This image 1906,1220,0.171",wrestling/wrestler;seascape;kabuki;dock/quay;actor/actress
1610,Sawamura Sojuro III as Hige no Ikyu ・ｸ・・ｻ｣・・ｮ・ｲ｢・・・・ｮ・・・・・・・・・ｮ・ｫｭ・・ｮ・・・・ｼ・,https://research.britishmuseum.org/collectionimages/AN00510/AN00510823_001_l.jpg,"Woodblock print. Kabuki. Actor Sawamura Sojuro as daimyo,about to draw his sword to kill courtesan Takao. Nishiki-e on paper.",daimyo;courtesan/prostitute;kabuki;arms/armour;actor/actress
1611,Kataoka Nizaemon VII as Yuri no Hachiro ・ｸ・・ｻ｣・・ｮ・・・・ｲ｡・ｻ・・ｷｦ・｡・・・・・ｮ・・ｱ・・ｩ・・ｮ・・ｫ・・・,https://research.britishmuseum.org/collectionimages/AN00510/AN00510817_001_l.jpg,"Woodblock print. Kabuki. Actor as the old woman of Adachigahara, leaning on her stick at the edge of a stream. Nishiki-e on paper.",kabuki;actor/actress
1612,"Backstage scene (・･ｽ・ｱ・・・ｮ・ｵｵ) Ichikawa Monnosuke II, Iwai Hanshiro IV and an apprentice actor (・ｺ・・ｻ｣・・ｮ・ｸ・・ｷ・・・・ｹ・・・ｩ・・・・・・ｻ｣・・ｮ・ｲｩ・ｺ・・・・・・・・・・・・ｨ・・・・・ｮ・ｼ・・ｭ・)",https://research.britishmuseum.org/collectionimages/AN00424/AN00424626_001_l.jpg,Woodblock print. Kabuki. Two actors in character with a servant by a door. Nishiki-e on paper.,servant/domestic worker;kabuki;actor/actress
1613,Iwai Hanshiro IV as Agemaki and Ichikawa Yaozo II as Sukeroku (・・・・ｻ｣・・ｮ・ｲｩ・ｺ・・・・・・・・・・・・ｮ・・・・ｷｻ・・ｨ・ｺ・・ｻ｣・・ｮ・ｸ・・ｷ・・・ｫ・・ｾ・・ｵ・・ｮ・・ｩ・・ｭ),https://research.britishmuseum.org/collectionimages/AN00424/AN00424622_001_l.jpg,Woodblock print. Kabuki. 2 actors as Agemaki and her lover Sukeroku under flowering cherry tree. Nishiki-e on paper.,tree/bush;kabuki;fruit;actor/actress
1614,Ichikawa Danjuro V as Sakata no Kintoki (・ｺ・・ｻ｣・・ｮ・ｸ・・ｷ・・・｣・・・・・・・・ｮ・・・・・ｰ・・ｮ・・・・・・),https://research.britishmuseum.org/collectionimages/AN00425/AN00425553_001_l.jpg,"Woodblock print. Kabuki. Actor Ichikawa Danjuro as Kintoki holding a lamp, the character 'kin' on his red cape.1 of 2. Nishiki-e on paper.",kabuki;actor/actress
1615,print / hashira-e,https://research.britishmuseum.org/collectionimages/AN00612/AN00612355_001_l.jpg,"Colour woodblock pillar print, hashira-e. Shidoken sitting in Asakusa Kannon Temple (Senso-ji) precincts, and banging on desk with wooden phallus. With poem. Inscribed, signed, sealed and marked.",trade/occupation
1616,print,https://research.britishmuseum.org/collectionimages/AN00521/AN00521717_001_l.jpg,"Print, colour woodblock print, showing imaginary trial of strength (kubihiki) between the Osaka kabuki actors Nakamura Utaemon III (right) and Bando Mitsugoro III (left), both in the role of Ishikawa Goemon (Utaemon III at Naka-za, Mitsugoro III in competition at Kado-za). Poems above by Hatsukuni and Chikakuni; signed.",kabuki;actor/actress
