,Title,Source,Description,Keywords
0,Gifu no bu / Ukiyo-onna Fuzoku Shuko,https://research.britishmuseum.org/collectionimages/AN00423/AN00423713_001_l.jpg,Woodblock print. Bijinga. Two courtesans out walking. Nishiki-e on paper.,courtesan/prostitute;bijin
1,Su / Ukiyo Rikugei Ryaku,https://research.britishmuseum.org/collectionimages/AN00423/AN00423161_001_l.jpg,"Woodblock print.Classical series. Popular culture. Two women measuring length of cloth, with verse above. 1 of 2. Nishiki-e on paper.",
2,print,https://research.britishmuseum.org/collectionimages/AN00421/AN00421017_001_l.jpg,"Woodblock print. Popular culture. The crow and the heron, couple walking in snow under an umbrella. Nishiki-e on paper.",snow;bird
3,Fuzoku Azuma no nishiki ・｢ｨ・ｿ・・・ｱ・ｹ・・・ｦ (Brocades of the East in Daily Life),https://research.britishmuseum.org/collectionimages/AN00595/AN00595832_001_l.jpg,Colour woodblock-printed diptych. Bush-clover garden: young samurai in formal attire; attended by tea-girl in garden at Ryoganji Temple at Kamedo; three women from the entertainment quarter ogling on right. Inscribed and signed.,garden
4,Ukiyo juroku musashi,https://research.britishmuseum.org/collectionimages/AN00537/AN00537401_001_l.jpg,"Woodblock print. Bijinga. Girl reading a letter, with board game inset. Nishiki-e on paper.",sport/pastime;bijin
5,O-jo / Ukiyo Nijushi-ko,https://research.britishmuseum.org/collectionimages/AN00246/AN00246310_001_l.jpg,Woodblock. Classical series. Woman and child with goldfish bowl. Nishiki-e on paper.,fish;child
6,Ada-kura ukiyo-e sugata,https://research.britishmuseum.org/collectionimages/AN00530/AN00530209_001_l.jpg,"Woodblock print. Bijinga. Love. Girl reading letter from a wrestler with, inset, open book of joruri. Nishiki-e on paper.",puppetry;wrestling/wrestler;bijin;courtship/love
7,Yamashiroya-uchi Hatsu-ito / Ukiyo Bijin Hana-Yose,https://research.britishmuseum.org/collectionimages/AN00421/AN00421999_001_l.jpg,"Woodblock print.Hagi tying kamuro's obi, monkey in hanging scroll reaching for love-letter. Poem. Nishiki-e on paper.",courtesan/prostitute;mammal;bijin;kamuro
8,Musume fu / Ukiyo bijin hana ni yosu,https://research.britishmuseum.org/collectionimages/AN00440/AN00440751_001_l.jpg,Woodblock print. Bijinga. Young couple by a tea-stall with hagi flowers in bloom. Poem. Nishiki-e on paper.,tea production/trade;flower;bijin
9,Ukiyo Bijin Hana-Mi-tate,https://research.britishmuseum.org/collectionimages/AN00421/AN00421973_001_l.jpg,"Woodblock print. Bijinga. Chojiya-uchi Chozan with her kamuro and friend preparing to smoke,with poem. Nishiki-e on paper.",courtesan/prostitute;literature;bijin;kamuro
10,Furyu Ukiyo Mu-Tamagawa,https://research.britishmuseum.org/collectionimages/AN00516/AN00516236_001_l.jpg,"Woodblock print. Bijinga. Classical series. Small boy upsetting goldfish bowl on veranda of house, watched by two women. Nishiki-e on paper.",fish;domestic building;child;bijin
11,diptych print,https://research.britishmuseum.org/collectionimages/AN00595/AN00595730_001_l.jpg,"Woodblock print, diptych. Popular culture. Women and girls cooling off on the waterfront at evening. Nishiki-e on paper.",child
15,Asakusa bansho (Evening Bell at Asakusa) / Furyu ukiyo hakkei (Stylish Eight Views of the Floating World),https://research.britishmuseum.org/collectionimages/AN00423/AN00423000_001_l.jpg,"Woodblock print. Bijinga. Classical series. Ofuji, seated outside father's cosmetic shop with friend holding firebox, with poem. Nishiki-e on paper.",shop;literature;bijin
16,print,https://research.britishmuseum.org/collectionimages/AN00516/AN00516199_001_l.jpg,Woodblock print. Bijinga. Two geisha performing the harugoma. Poems. Nishiki-e on paper.,geisha;dance;bijin
17,Su / Ukiyo Rokugei Ryaku,https://research.britishmuseum.org/collectionimages/AN00423/AN00423805_001_l.jpg,"Woodblock. Two women measuring cloth for a dress in a room, with poem. Nishiki-e on paper.",costume/clothing
18,triptych print,https://research.britishmuseum.org/collectionimages/AN00611/AN00611840_001_l.jpg,"Woodblock print, triptych. Popular culture. Travellers pausing on the beach at Enoshima. Nishiki-e on paper.",traveller/travel;beach scene
19,Aki kusa ・ｧ・・・・・・・ (Autumn Grasses) / Ukiyo fuzoku tsu ・ｵｮ・ｸ・・｢ｨ・ｿ・・・ (Complete Customs of the Floating World),https://research.britishmuseum.org/collectionimages/AN00453/AN00453874_001_l.jpg,"Woodblock print, triptych. Plucking flowers.",flower;bijin
20,print,https://research.britishmuseum.org/collectionimages/AN00423/AN00423067_001_l.jpg,Woodblock print. Kachoga. Chinese-style planter or vase with chrysanthemums against the setting sun. Nishiki-e on paper.,sun/moon;vessel;flower
21,print,https://research.britishmuseum.org/collectionimages/AN00440/AN00440425_001_l.jpg,Woodblock print. Popular culture. Youth and girl collecting persimmons by a stream. Nishiki-e on paper.,fruit;child
22,Haikai iro no minato,https://research.britishmuseum.org/collectionimages/AN00422/AN00422954_001_l.jpg,Woodblock print. Popular culture. 2 girls in a fashionable house dressing up a man as Daruma. Nishiki-e on paper.,domestic building;child;haiku
23,print,https://research.britishmuseum.org/collectionimages/AN00423/AN00423027_001_l.jpg,"Woodblock print. Bijinga. Courtesan and dog in the garden of a fashionable house at evening, a view of the party through the shoji. Nishiki-e on paper.",time/seasons;leisure/entertainment;courtesan/prostitute;garden;domestic building;bijin;dog
24,print,https://research.britishmuseum.org/collectionimages/AN00422/AN00422227_001_l.jpg,"Woodblock print. Popular culture. 2 young men,suitably attired,on their way to a shrine and leading a fretful horse. Nishiki-e on paper.",shrine;horse/ass
25,print,https://research.britishmuseum.org/collectionimages/AN00422/AN00422225_001_l.jpg,Woodblock print. Popular culture. Couple fixing kadomatsu for the New Year in the gateway of their house. Poem. Nishiki-e on paper.,domestic building;arch/gateway
26,print,https://research.britishmuseum.org/collectionimages/AN00422/AN00422222_001_l.jpg,Woodblock print. Bijinga. Two courtesans in an entrance hall examining a letter. Nishiki-e on paper.,courtesan/prostitute;interior;bijin
27,print,https://research.britishmuseum.org/collectionimages/AN00422/AN00422217_001_l.jpg,"Woodblock print. Popular culture. Woman, stripped to the waist, washing her little boy's face on the veranda. Nishiki-e on paper.",child
28,Haikai iro no minato,https://research.britishmuseum.org/collectionimages/AN00440/AN00440703_001_l.jpg,Woodblock print. Bijinga. Courtesan dictating letter to her kamuro in her bedroom. Nishiki-e on paper.,courtesan/prostitute;bijin;bedroom;kamuro;haiku
29,print,https://research.britishmuseum.org/collectionimages/AN00421/AN00421977_001_l.jpg,Woodblock print. Small boys wrestling. Nishiki-e on paper.,wrestling/wrestler;child
30,print,https://research.britishmuseum.org/collectionimages/AN00422/AN00422050_001_l.jpg,"Woodblock print. Bijinga. Courtesan seated outside a shop with a pipe in one hand and other arm around kamuro, probably whispering. Nishiki-e on paper.",smoking;shop;courtesan/prostitute;bijin;kamuro
31,print,https://research.britishmuseum.org/collectionimages/AN00422/AN00422138_001_l.jpg,Woodblock print. Bijinga. Father and son wading in stream with large fishing net. Nishiki-e on paper.,fisherman/fishing;bijin
32,print,https://research.britishmuseum.org/collectionimages/AN00422/AN00422135_001_l.jpg,Woodblock print. Bijinga. Two young women on a veranda with small boy teasing the goldfish in a large bowl. Nishiki-e on paper.,fish;child;bijin
33,print,https://research.britishmuseum.org/collectionimages/AN00274/AN00274619_001_l.jpg,"Woodblock. Bijinga. O-Sen, the famous beauty of Kagiya tea-house, with poem. Nishiki-e on paper.",tea-house;literature;bijin
34,print,https://research.britishmuseum.org/collectionimages/AN00423/AN00423005_001_l.jpg,"Woodblock print.Lovers parting sorrowfully, as the first bird of the new day flies by, with poem. Nishiki-e on paper.",literature;bird
35,print,https://research.britishmuseum.org/collectionimages/AN00423/AN00423002_001_l.jpg,Woodblock print. Bijinga. Three girls seated on the floor by an open fusuma playing the game of ken and taking refreshments. Nishiki-e on paper.,sport/pastime;child;bijin
36,shunga / painting / handscroll,https://research.britishmuseum.org/collectionimages/AN00776/AN00776110_001_l.jpg,"Painting, handscroll. Scenes of love-making. Ink, colours and gold on paper. With wrapping cloth and paulownia storage box.",eroticism/sex
37,print,https://research.britishmuseum.org/collectionimages/AN00422/AN00422311_001_l.jpg,"Woodblock print. Popular culture. Girl with mop standing on stairs, apparently trying to prevent her husband or lover from dressing, he with a letter. Nishiki-e on paper.",architectural feature
38,Ayase no sekisho (Evening Glow at Ayase) / Bokusui hakkei (Eight Views of the River Sumida),https://research.britishmuseum.org/collectionimages/AN00510/AN00510294_001_l.jpg,"Woodblock print. Bijinga. Classical series. Two girls on a veranda enjoying the view, one through a telescope. (According to register, on a balcony). Nishiki-e on paper.",scientific instrument;child;bijin;architectural feature
39,print,https://research.britishmuseum.org/collectionimages/AN00534/AN00534113_001_l.jpg,"Woodblock print. Bijinga. Courtesan seated with a plectrum in her right hand and a samisen just in view on the floor at her side (According to register, Geisha). Nishiki-e on paper.",musical instrument;geisha;bijin
40,Seiro bijin rokkasen ・・・・･ｼ・ｾ・・ｺｺ・・ｭ・・ｱ・ｻ・ (Six Blossoming Immortals of Yoshiwara),https://research.britishmuseum.org/collectionimages/AN00524/AN00524239_001_l.jpg,Woodblock print.Classical series. Bijinga. Kisegawa of the Matsubaya looking at a handscroll of the 'Ise monogatari'. Nishiki-e on paper.,literature;bijin
41,shunga / print,https://research.britishmuseum.org/collectionimages/AN00583/AN00583022_001_l.jpg,"Colour woodblock print, shunga. Lovers in bed quilts in front of a screen decorated with a Chinese landscape.",courtesan/prostitute;landscape;eroticism/sex;brothel/brothel-keeper
42,shunga / print,https://research.britishmuseum.org/collectionimages/AN00583/AN00583023_001_l.jpg,"Colour woodblock print, shunga. Lovers and child in an interior.",eroticism/sex;child
43,Otome / Maiden,https://research.britishmuseum.org/collectionimages/AN00311/AN00311013_001_l.jpg,Etching. Four cubes with images from Ukiyo-e prints on their surfaces. Annotations. 29/60,
44,Ukiyo no hana (Flowers of the Floating World),https://research.britishmuseum.org/collectionimages/AN00434/AN00434443_001_l.jpg,Woodblock print. Girl preparing to paint.,child
45,painting,https://research.britishmuseum.org/collectionimages/AN00756/AN00756149_001_l.jpg,Preparatory sketch for a painting. Young samurai reclining across the lap of a courtesan. Ink and colour on paper.,samurai;courtesan/prostitute
46,painting / hanging scroll,https://research.britishmuseum.org/collectionimages/AN00229/AN00229844_001_l.jpg,Hanging scroll. Beauty with kamuro.,courtesan/prostitute;kamuro
47,drawing,https://research.britishmuseum.org/collectionimages/AN00792/AN00792469_001_l.jpg,Sketch. Study of a wave breaking. Ink on paper.,seascape
49,print,https://research.britishmuseum.org/collectionimages/AN00436/AN00436665_001_l.jpg,Woodblock print. Millet and bird.,bird
50,print,https://research.britishmuseum.org/collectionimages/AN00436/AN00436661_001_l.jpg,Woodblock print. Crow and blossom.,bird and flower
51,print,https://research.britishmuseum.org/collectionimages/AN00436/AN00436658_001_l.jpg,Woodblock print. Bird and persimmon.,fruit;bird
52,print,https://research.britishmuseum.org/collectionimages/AN00436/AN00436657_001_l.jpg,Woodblock print. Hawk and hare.,mammal;bird
56,triptych print,https://research.britishmuseum.org/collectionimages/AN00439/AN00439907_001_l.jpg,"Woodblock print, triptych. Horsemen fighting.",warrior;mammal;equestrian
57,triptych print,https://research.britishmuseum.org/collectionimages/AN00439/AN00439888_001_l.jpg,"Woodblock print, triptych. Council of warriors.",warrior
58,print,https://research.britishmuseum.org/collectionimages/AN00423/AN00423097_001_l.jpg,Print. Woman with mushroom basket paddling in stream.,fungus
62,print,https://research.britishmuseum.org/collectionimages/AN00422/AN00422974_001_l.jpg,Woodblock print. Popular culture. Lovers embracing behind a screen. Nishiki-e on paper.,
63,print,https://research.britishmuseum.org/collectionimages/AN00422/AN00422000_001_l.jpg,Woodblock print. Bijinga. Two girls chatting and smoking in an open room. Nishiki-e on paper.,child;bijin
64,print,https://research.britishmuseum.org/collectionimages/AN00421/AN00421936_001_l.jpg,Woodblock print.Cormorant fishing by night. Nishiki-e on paper.,fisherman/fishing;bird
65,print,https://research.britishmuseum.org/collectionimages/AN00432/AN00432106_001_l.jpg,Woodblock print. Two warriors. Nishiki-e on paper.,warrior
66,print,https://research.britishmuseum.org/collectionimages/AN00431/AN00431958_001_l.jpg,Woodblock print. Courtesan and attendant. Nishiki-e on paper.,courtesan/prostitute
67,print / album,https://research.britishmuseum.org/collectionimages/AN00837/AN00837998_001_l.jpg,"Colour woodblock print, ten sheets mounted in an album.  Cover A",
69,print,https://research.britishmuseum.org/collectionimages/AN00422/AN00422265_001_l.jpg,Woodblock print.Hares leaping over waves in the moonlight. Nishiki-e on paper.,moon;mammal
70,print,https://research.britishmuseum.org/collectionimages/AN00510/AN00510671_001_l.jpg,Woodblock print. Popular culture. Lady attending samurai in dressing-room scene. Nishiki-e on paper.,samurai
71,surimono,https://research.britishmuseum.org/collectionimages/AN00612/AN00612250_001_l.jpg,"Woodblock print, Shijo/Ukiyo-e surimono. Hobby horse and tebune (toys). Printed text above records text of a song 'Sumiyoshi tebune'. Printed signature & seal.",toy
72,Ju-damme / Ukiyo Chushingura,https://research.britishmuseum.org/collectionimages/AN00529/AN00529355_001_l.jpg,"Woodblock print.Classical literature. Act X, O-Sono, wife of Gihei, attempting to enter husband's house, with two attendants. Nishiki-e on paper.",attendant;literature;domestic building
73,Maboroshi rakugan / Ukiyo Genji hakkei,https://research.britishmuseum.org/collectionimages/AN00524/AN00524266_001_l.jpg,"Woodblock print. Popular culture. Classical literature. Two girls reading poems written on tanzaku with, inset, geese over marshland. Nishiki-e on paper.",poetry;literature;landscape;bird
74,Hashihime sekisho / Ukiyo Genji hakkei,https://research.britishmuseum.org/collectionimages/AN00524/AN00524263_001_l.jpg,"Woodblock print. Popular culture. Classical literature. Two women looking at handscroll of watery scene with a bridge, with bridge inset above. Nishiki-e on paper.",literature;bridge
75,Uma ([Hour of the] Horse [Noon]) / Ukiyo juni-shi (Twelve Hours of the Floating World),https://research.britishmuseum.org/collectionimages/AN00513/AN00513180_001_l.jpg,"Woodblock print. Popular culture. Uki-e. Horse, two girls at tea-stall smiling at man going to Meguro and horse picture in hair, with clappers. Nishiki-e on paper. According to reg. The twelve hours: noon.",tea production/trade;child;horse/ass
76,Furyu Nanatsume E-awase,https://research.britishmuseum.org/collectionimages/AN00516/AN00516198_001_l.jpg,Woodblock print. Popular culture. Head and shoulders of mother holding a baby with a toy snake in his hand. Nishiki-e on paper.,toy;reptile;child
77,Hagi-dera / Koto Hana Ju-kei,https://research.britishmuseum.org/collectionimages/AN00513/AN00513144_001_l.jpg,"Woodblock print. Bijinga. Rural landscape. The temple of Hagi, two girls admiring lespedeza shrubs. Nishiki-e on paper.",tree/bush;temple;landscape;child;bijin
78,Dai-ichi Yamashiro Shunzei / Ukiyo Mu-Tamagawa,https://research.britishmuseum.org/collectionimages/AN00423/AN00423934_001_l.jpg,"Woodblock print. Popular culture. Young nobleman crossing River Ide on horse, with valet. Poem by Shunzei. Nishiki-e on paper.",servant/domestic worker;equestrian
79,Ushi / Ukiyo Juni-shi,https://research.britishmuseum.org/collectionimages/AN00513/AN00513179_001_l.jpg,Woodblock print. Oharame country girls with bundles of faggots and an ox by a river under maple trees. Nishiki-e on paper.,tool/implement;tree/bush;mammal;child
80,painting,https://research.britishmuseum.org/collectionimages/AN00759/AN00759308_001_l.jpg,"Painting, album leaf. Snow-capped Nikko mountain. Ink and colours on paper.",snow;landscape
81,painting,https://research.britishmuseum.org/collectionimages/AN00759/AN00759304_001_l.jpg,"Painting, album leaf. View of lake beyond mast, with boat. Ink and colours on paper.",landscape;boat/ship
82,painting,https://research.britishmuseum.org/collectionimages/AN00759/AN00759295_001_l.jpg,"Painting, album leaf. Boat by reedy shore. Ink and colours on paper.",seascape;plant;boat/ship
83,painting,https://research.britishmuseum.org/collectionimages/AN00759/AN00759280_001_l.jpg,"Painting, album leaf. Cottages by stream. Ink and colours on paper.",landscape;cottage
84,Chamise no kane no oto (The Bell Sounding at the Teahouse) / Ukiyo hakkei (Eight Views of the Floating World),https://research.britishmuseum.org/collectionimages/AN00638/AN00638488_001_l.jpg,Woodblock print. Young man with towel and spittoon in hands crouching by girl with hairpin. Nishiki-e on paper.,vessel;child
85,Ueno - Sentaku (Ueno - Laundry) / Ukiyo meijo zue (Landscapes and Various Women of Today),https://research.britishmuseum.org/collectionimages/AN00535/AN00535775_001_l.jpg,"Woodblock print. Girl washing clothing in a tub, with fan-shaped cartouche containing view of Ueno.",bijin
86,Kinryuzan no bosetsu / Furyu Edo hakkei,https://research.britishmuseum.org/collectionimages/AN00422/AN00422018_001_l.jpg,"Woodblock print. Popular culture. Classical series, Townscape. Gentleman and two ladies smoking and playing sugoroku. Poem. Nishiki-e on paper.",sport/pastime;landscape
87,print,https://research.britishmuseum.org/collectionimages/AN00423/AN00423022_001_l.jpg,"Woodblock print. Popular culture. Young gentleman + lady in traditional court dress by bell-shaped open window,Ono no Komachi and Ariwara no Narihira. Nishiki-e on paper.",royal/imperial
88,Uchu no gan,https://research.britishmuseum.org/collectionimages/AN00421/AN00421993_001_l.jpg,Woodblock print. Bijinga. Courtesan with her kamuro on a veranda gazing at geese flying across the night sky.Poem. Nishiki-e on paper.,courtesan/prostitute;bird;bijin;kamuro
89,print,https://research.britishmuseum.org/collectionimages/AN00422/AN00422190_001_l.jpg,"Woodblock print. Popular culture. Mother and child in open room in early summer, she pulling mosquito-net, he the bottom of her yukata. Nishiki-e on paper.",seasons;child
90,print,https://research.britishmuseum.org/collectionimages/AN00440/AN00440423_001_l.jpg,Woodblock print. Boys wrestling in front of pergola with wisteria and poem. Nishiki-e on paper.,wrestling/wrestler;plant;literature;garden architecture;child
91,print,https://research.britishmuseum.org/collectionimages/AN00422/AN00422171_001_l.jpg,Woodblock print. Kachoga. Two pheasants and peach-blossom beside a stream. Nishiki-e on paper.,peach blossom;fruit;bird
92,print,https://research.britishmuseum.org/collectionimages/AN00422/AN00422158_001_l.jpg,"Woodblock print. Popular culture. Bijinga. New Year offering, a small girl holding out figure of white rabbit on tray to woman in snowy garden. Nishiki-e on paper.",snow;mammal;garden;child;bijin
93,print,https://research.britishmuseum.org/collectionimages/AN00440/AN00440426_001_l.jpg,"Woodblock print.History, myth and legend. The famous fight on Gojo bridge between Ushiwaka and Benkei. Nishiki-e on paper.",myth/legend;history;bridge
94,painting / hanging scroll,https://research.britishmuseum.org/collectionimages/AN00229/AN00229241_001_l.jpg,Hanging scroll. Geisha. Ink and colours and gold on silk.,geisha
95,Ueno Kiyomizu-zaka / Toto Meisho Saka-zukushi no uchi,https://research.britishmuseum.org/collectionimages/AN00518/AN00518045_001_l.jpg,"Woodblock print. Rural landscape. Kiyomizu hill,Ueno. Nishiki-e on paper.",landscape
96,Shimosai Konodai / Kanto Meisho Zue,https://research.britishmuseum.org/collectionimages/AN00535/AN00535339_001_l.jpg,"Woodblock print. Rural landscape. View from cliff across estuary with boats. (According to register, at Konodai, Shimosa province). Nishiki-e on paper.",landscape;boat/ship
97,shunga / print,https://research.britishmuseum.org/collectionimages/AN00583/AN00583013_001_l.jpg,"Woodblock print, shunga. No.1 of a set of twelve. Lovers in front of screen with sake set. According to register set of seven erotic prints in black only; one signed Kiyonobu.",vessel;courtesan/prostitute;eroticism/sex
98,shunga / print,https://research.britishmuseum.org/collectionimages/AN00583/AN00583014_001_l.jpg,"Woodblock print, shunga. Lovers and discarded uchikake (over-kimono).",eroticism/sex
99,shunga / print,https://research.britishmuseum.org/collectionimages/AN00583/AN00583015_001_l.jpg,Shunga. Lovers in front of screen drinking sake. Woodblock-printed,vessel;eroticism/sex
100,shunga / print,https://research.britishmuseum.org/collectionimages/AN00583/AN00583017_001_l.jpg,Shunga. Lovers and kamuro. Woodblock-printed,courtesan/prostitute;eroticism/sex;kamuro
101,Shinagawa kihan ・・・・ｷ・・ｵｷ・ｸ・ (Returning Sails at Shinagawa) / Furyu ukiyo hakkei ・｢ｨ・ｵ・・ｵｮ・ｸ・・・ｫ・・ｯ (Eight Views of the Elegant Floating World),https://research.britishmuseum.org/collectionimages/AN00422/AN00422214_001_l.jpg,Colour woodblock print. Prostitute down coast at Shinagawa in early morning watching returning boats. With poem. Inscribed and signed.,courtesan/prostitute;boat/ship;bijin
102,print,https://research.britishmuseum.org/collectionimages/AN00513/AN00513269_001_l.jpg,"Colour woodblock print with powdered mica ground. Actor Ichikawa Komazo II as Shiga Daishichi in play 'A Medley of Tales of Revenge'; holding sword. Signed, sealed and marked.",kabuki;actor/actress
103,Koi no minakami ・・・・・ｮ・ｰｴ・・・・・ｿ (The Sources of Love) / Koi ([hashira title]),https://research.britishmuseum.org/collectionimages/AN00776/AN00776100_001_l.jpg,"Illustrated book, one volume (complete), remounted as a folding album. Woodblock-printed, with later hand-colouring. Handwritten preface added by Ota Nampo, 7th month, 1808.",
104,print,https://research.britishmuseum.org/collectionimages/AN00421/AN00421927_001_l.jpg,Woodblock print. Popular culture. The interior of a fukiya-mise (shop). Nishiki-e on paper.,sport/pastime;shop
105,print,https://research.britishmuseum.org/collectionimages/AN00521/AN00521335_001_l.jpg,"Woodblock print. Kabuki. Actor Otani Oniji and Ichikawa Omezo,half kneeling as Ukiyo Tsuchihei and th wrestler Ikazuchi Tsuranosuke. Nishiki-e on paper.",wrestling/wrestler;kabuki;actor/actress
106,print,https://research.britishmuseum.org/collectionimages/AN00422/AN00422131_001_l.jpg,Colour woodblock print. Eirakuan tea-house at Gion: senior maid carrying warmed sake to client in inner room; junior maid warming sake in corridor. Signed and inscribed.,tea-house
107,print,https://research.britishmuseum.org/collectionimages/AN00422/AN00422934_001_l.jpg,"Woodblock print. Popular culture. Young girl helping her shy lover off with his sash, watched through sliding doorway by another woman. Nishiki-e on paper.",interior;eroticism/sex;clock
108,print,https://research.britishmuseum.org/collectionimages/AN00525/AN00525492_001_l.jpg,"Colour woodblock print with powdered black mica ground. Bijinga. Catching fireflies: woman holding firefly cage; boy pursuing insects; iris along stream in background. Signed, marked and sealed.",bijin
109,Atago no shugetsu ・・・・ｮ・・ｧ・・・・ (Autumn Moon over Atago) / Edo hakkei・・ｱ・・・ｸ・・ｫ・・ｯ (Eight Views of Edo),https://research.britishmuseum.org/collectionimages/AN00513/AN00513199_001_l.jpg,"Woodblock print.Classical series. Rural landscape. Autumn moon at Atago with view of temple inset. Nishiki-e on paper. According to register, Edo Hakkei",temple;moon;landscape
110,Ryogoku-bashi no sekisho ・ｸ｡・・ｽ・ｩ・・､・・・ｧ (Evening Glow at Ryogoku Bridge) / Edo hakkei・・ｱ・・・ｽ・・ｫ・・ｯ,https://research.britishmuseum.org/collectionimages/AN00513/AN00513194_001_l.jpg,"Woodblock print.Classical series. Rural landscape. Evening glow at Ryogoku Bridge,with,inset,view of bridge from below. Nishiki-e on paper. According to register, Edo Hakkei.",landscape
111,Dai-go Mutsu Noin / Ukiyo Mu-Tamagawa,https://research.britishmuseum.org/collectionimages/AN00423/AN00423937_001_l.jpg,Woodblock print. Bijinga. Two girls under umbrella watching plovers of Priest Noin's poem by River Noda. Nishiki-e on paper.,literature;child;bird;bijin
112,Fuzoku Azuma no nishiki ・｢ｨ・ｿ・・・ｱ・ｹ・・・ｦ (Brocades of the East in Daily Life),https://research.britishmuseum.org/collectionimages/AN00513/AN00513387_001_l.jpg,"Woodblock print. Small boy from a noble family on a visit to a shrine with mother and possibly aunt,+ maid-servant with umbrella. Nishiki-e on paper.",shrine;servant/domestic worker;child
113,Kyu Meguro / Edo Meisho Juni-gatsu,https://research.britishmuseum.org/collectionimages/AN00423/AN00423159_001_l.jpg,"Woodblock print. Popular culture. A girl of the Toshimaya offering tea to a male guest with his page (According to register, ninth month). Nishiki-e on paper.",tea preparation/drinking;servant/domestic worker;child
